Pepperfry,AM1,1,SpaghettiCoders,Harshit Budhraja,NIIT UNIVERSITY,Confirm Your Participation
2,Jobless_coders,Krishna Bose,KALYANI GOVERNMENT ENGINEERING COLLEGE,Confirm Your Participation
3,Dominion,Virag Shende,MIT ACADEMY OF ENGINEERING,Confirm Your Participation
AM2,1,Sarathi,Gauri Patil,KITS COLLEGE OF ENGINEERING,Confirm Your Participation
2,Star_coders_42!!,Hephzibah Saidu,CHAITANYA BHARATHI INSTITUTE OF TECHNOLOGY,Confirm Your Participation
3,ProCoders,Boon U,CVR COLLEGE OF ENGINEERING,Confirm Your Participation
Everest,KK4,1,CyberCasual,Adil Rahman,HERITAGE INSTITUTE OF TECHNOLOGY,Confirm Your Participation
2,LOVELACE EXTENSIONS,K.VIJAYA BABU,DNR COLLEGE OF ENGINEERING & TECHNOLOGY,Confirm Your Participation
3,Thai Tech,Ashik Aliyar,JAIBHARATH COLLEGE OF MANAGEMENT & ENGINEERING TECHNOLOGY,Confirm Your Participation
4,Dead Coders,SHIVANI R K,ST. JOSEPH'S COLLEGE OF ENGINEERING,Confirm Your Participation
KK6,1,MISSION IMPOSSIBLE,SABARI U,A.V.C.COLLEGE OF ENGINEERING,Confirm Your Participation
2,Hack_Elite1@2,Ishapreet Kaur,"National Institute of Technology, Kurukshetra",Confirm Your Participation
3,Hack  Elite,Sagar Deshmukh,JSPM'S RAJARSHI SHAHU COLLEGE OF ENGINEERING,Confirm Your Participation
Ministry of Labour,SK1,1,CODErador,Arya Awasthi,ORIENTAL COLLEGE OF TECHNOLOGY,Confirm Your Participation
2,IndiaHacks,Chaitanya Shah,Shri Vaishnav Vidyapeeth Vishwavidyalaya,Confirm Your Participation
3,The Phoenix Tech,Shubham Kumar Sahu,KALINGA INSTITUE OF INDUSTRIAL TECHNOLOGY,Confirm Your Participation
4,CSEC16SIH2019-43,ABDUL MUQEET OSAMA,BHARAT INSTITUTE OF ENGINEERING AND TECHNOLOGY,Confirm Your Participation
SK2,1,Team Saahas,Venu Gopal Balli,VISHNU INSTITUTE OF TECHNOLOGY,Confirm Your Participation
2,The_Ultimate,Mohammad umair,ABES INSTITUTE OF TECHNOLOGY,Confirm Your Participation
3,SQUADRONE,Ria Jha,INDIRA GANDHI DELHI TECHNICAL UNIVERSITY FOR WOMEN,Confirm Your Participation
4,AIcoders,Mayank Singh,Indian Institute of Technology Jammu,Confirm Your Participation
SK3,1,Space Reboot,Alvajahat Khan,SHRI RAM INSTITUTE OF SC & TECHNOLOGY,Confirm Your Participation
2,Rahasya,Rutuja Kalbhor,"MIT Art, Design and Technology University, Pune",Confirm Your Participation
3,ARCANA,Pratiksha Walbe,"M.G.M'S COLLEGE OF ENGINEERING ,NANDED",Confirm Your Participation
4,Razzle-Dazzle,Sabeetha V,ADHI COLLEGE OF ENGINEERING AND TECNOLOGY,Confirm Your Participation
Ministry of Textiles,CP3,1,Mount@ineers...,Harshali Tayade,SSBT'S COLLEGE OF ENGINEERING & TECHNOLOGY,Confirm Your Participation
2,Codevamps,Haris Tyagi,MEERUT INSTITUTE OF TECHNOLOGY,Confirm Your Participation
3,Sinister6,Aditi Joshi,SCTR'S PUNE INSTITUTE OF COMPUTER TECHNOLOGY,Confirm Your Participation
4,HACK INVERSION,Venkata Anudeep Dumpala,SAGI RAMAKRISHNAM RAJU ENGINEERING COLLEGE,Confirm Your Participation
Ministry of Railways,BB2,1,Xorticans,Saravanan S K,MEPCO SCHLENK ENGINEERING COLLEGE,Confirm Your Participation
2,Raitron,Aditya -,CHANDIGARH ENGINEERING COLLEGE,Confirm Your Participation
3,CSIT-phoenix birds,Aliya K,MADANAPALLE INSTITUTE OF TECHNOLOGY & SCIENCE,Confirm Your Participation
4,TECHNO6,AKASH SHARMA,TERNA PUBLIC CHARITABLE TRUST'S  TERNA  ENGINEERING COLLEGE,Confirm Your Participation
BB3,1,Tybom_2k19,Muskan Goel,DELHI TECHNOLOGICAL UNIVERSITY,Confirm Your Participation
2,Shareware_Magnets,R AMARTYA,"Indian Institute of Technology, Kharagpur",Confirm Your Participation
3,Zeniith,Gaurav Sangle,"Birla Institute of Technology & Sciences, Pilani",Confirm Your Participation
4,Nanobit,Vishal Kataria,K.J. SOMAIYA INSTITTUTE OF MANAGEMENT STUDIES & RESERACH,Confirm Your Participation
BB4,1,Gully_Devs,Soumitra Shukla,INSTITUTE OF ENGINEERING AND TECHNOLOGY,Confirm Your Participation
2,ateamhasnoname,Nilansh Rajput,"Indian Institute of Technology, Ropar",Confirm Your Participation
3,BLUE PETROS,Ganesan S,RAJIV GANDHI COLLEGE OF ENGINEERING AND TECHNOLOGY,Confirm Your Participation
4,DNA,Muzzafer Ali,"Indian Institute of Technology, Jodhpur",Confirm Your Participation
Ministry of Statistics,KK4,1,RISC Takers,Rahmeen Habib,NETAJI SUBHAS INSTITUTE OF TECHNOLOGY,Confirm Your Participation
2,Darpan,Sahil Chhillar,Hans Raj College,Confirm Your Participation
3,Team Cipher Squad,Shatakshi Singh,"National Institute of Technology, Patna",Confirm Your Participation
4,Eureka_404,Prabal Bhatnagar,"Indian Institute of Technology, Goa",Confirm Your Participation
Ministry of Water Resources,GG1,1,Team NEBULA,Debashis Nandy,BRAINWARE UNIVERSITY,Confirm Your Participation
2,Pepsi,Yash Pathak,Lovely Professional University,Confirm Your Participation
3,TechFIREE,Utkarsh Vikram Singh,"University of Petroleum and Energy Studies, Dehradun",Confirm Your Participation
4,xTitans,Shubham Patil,VISHWAKARMA INSTITUTE OF INFORMATION TECHNOLOGY,Confirm Your Participation
GG2,1,Cit'z Feedbackers,Swetha K,"PSNA COLLEGE OF ENGINEERING AND TECHNOLOGY , DINDIGUL",Confirm Your Participation
2,Gryffindor06,Janet Reshma J,SRI SIVASUBRMANIYA NADAR COLLEGE OF ENGINEERING,Confirm Your Participation
3,Squirtle Squad,Saurabh Singh,"Indian Institute of Technology, Roorkee",Confirm Your Participation
4,QueueOverflow,Jeel Vaishnav,"Nirma University, Ahmedabad",Confirm Your Participation
GG3,1,THE FACELESS CREED,Vishrut Dwivedi,VELLORE INSTITUTE OF TECHNOLOGY CHENNAI OFF CAMPUS,Confirm Your Participation
2,Creative Army,Sourabh Singh,JSS ACADEMY OF TECHNICAL EDUCATION,Confirm Your Participation
3,Coderz,Sanjay Nayak,SHRI VILE PARLE KELAVANI MANDAL'S DWARKADAS J. SANGHVI COLLEGE OF ENGINEERING,Confirm Your Participation
4,BlackHawks101,Aman Kumar Singh,BIRLA INSTITUTE OF TECHNOLOGY,Confirm Your Participation
GG4,1,hiddenforprivacy,Shivam Balikondwar,SCTR'S PUNE INSTITUTE OF COMPUTER TECHNOLOGY,Confirm Your Participation
2,Instance@6,Rohit Dandamudi,CHAITANYA BHARATHI INSTITUTE OF TECHNOLOGY,Confirm Your Participation
3,ZenithCoders,ROHIT K,S.A.ENGINEERING COLLEGE,Confirm Your Participation
4,VISION _QUEST1.0,Duggi Niharika Sai,BHOJ REDDY ENGINEERING COLLEGE FOR WOMEN,Confirm Your Participation
GG6,1,RandomSix,Kush Daga,THAPAR INSTITUTE OF ENGINEERING AND TECHNOLOGY,Confirm Your Participation
2,Robosapling,SIVADHARSHINI M,M.KUMARASAMY COLLEGE OF ENGINEERING,Confirm Your Participation
3,The Intents,Akshita Rajoria,"Poornima Institute of Engineering & Technology,Jaipur",Confirm Your Participation
4,Techno Aspirants,Grishma sunkara,SHRI VISHNU ENGINEERING COLLEGE FOR WOMEN,Confirm Your Participation
Ministry of Civil Aviation,AK1,1,Under Pressure,Siddharth Singh,GURU GOBIND SINGH INDRAPRASTHA UNIVERSITY,Confirm Your Participation
2,#ave_@_Byte,Himanshu Giri,S.R. M INSTITUTE OF SCIENCE AND TECHNOLOGY,Confirm Your Participation
3,Hackoz,Bhaskar Verma,HITKARNI COLLEGE OF ENGINEERING & TECHNOLOGY,Confirm Your Participation
4,Pacman-Bytes,K Tarun Naidu,"K S Institute of Technology, BANGALORE",Confirm Your Participation
AK2,1,DELTA_X,Tanmay Mishra,VIDYALANKAR INSTITUTE OF TECHNOLOGY,Confirm Your Participation
2,GEC Titans,Shivam Kurtarkar,GOA COLLEGE OF ENGINEERING (GOVERNMENT OF GOA),Confirm Your Participation
3,Tangle,Santhosh Kumar. S,ST. JOSEPH'S COLLEGE OF ENGINEERING,Confirm Your Participation
4,Vortex,Vedant Sahai,FR. CONCEICAO RODRIGUES COLLEGE OF ENGINEERING,Confirm Your Participation
AK3,1,Arjuna.,Vasudev Awatramani,MAHARAJA AGRASEN INSTITUTE OF TECHNOLOGY,Confirm Your Participation
2,Aviato,Toshit Som,INTERNATIONAL INSTITUTE OF INFORMATION TECHNOLOGY BHUBANESWAR,Confirm Your Participation
3,A-team,Alvis F,ST. JOSEPH'S COLLEGE OF ENGINEERING,Confirm Your Participation
4,Tech_Pirates,DURGA V,ST. JOSEPH'S COLLEGE OF ENGINEERING,Confirm Your Participation
AK4,1,Dry Point,PRADEEP KUMAR,"INDIAN INSTITUTE OF INFORMATION TECHNOLOGY, UNA",Confirm Your Participation
2,Decoder Pirates,Amaresh Parida,"GANDHI INSTITUTE FOR TECHNOLOGY(GIFT), BHUBANESWAR",Confirm Your Participation
3,The FrontLine,Dhanashree Bendarkar,"GOVERNMENT COLLEGE OF ENGINEERING, AURANGABAD (ACADEMIC AUTONOMOUS)",Confirm Your Participation
4,MATRIX_VESIT,RAHUL BHATIA,VIVEKANAND EDUCATION SOCIETY'S INSTITUTE OF TECHNOLOGY,Confirm Your Participation
AK5,1,John Wick,Himalaya Singh Verma,MAHARAJA AGRASEN INSTITUTE OF TECHNOLOGY,Confirm Your Participation
2,The Rivals,Arun J,SRI KRISHNA COLLEGE OF ENGINEERING AND TECHNOLOGY,Confirm Your Participation
3,BootLoaders,Harish Balasubramanian,SIES GRADUATE SCHOOL OF TECHNOLOGY,Confirm Your Participation
4,DarkSavior,Shobhit Shukla,LAKSHMI NARAIN COLLEGE OF TECHNOLOGY EXCELLENCE,Confirm Your Participation
Ministry of Power,PK1,1,VAYUNA,Dibyajyoti Chatterjee,JORHAT ENGINEERING COLLEGE,Confirm Your Participation
2,Parallel_Minds,Niranjan Sabne,DR. VISHWANATH KARAD MIT WORLD PEACE  UNIVERSITY,Confirm Your Participation
3,pragaty,Akshay Anand,ST. THOMAS' COLLEGE OF ENGINEERING & TECHNOLOGY,Confirm Your Participation
4,HexasquadCoders,Akshita Pargir,"LAKSHMI NARAIN COLLEGE OF TECHNOLOGY, INDORE",Confirm Your Participation
PK2,1,Cryptic_Coders,Meghana BS,"K S Institute of Technology, BANGALORE",Confirm Your Participation
2,Namespace,Rajendra Prajapat,"INDIAN INSTITUTE OF INFORMATION TECHNOLOGY, DHARWAD",Confirm Your Participation
3,Dreamx,SRIRAM B,PANIMALAR INSTITUTE OF TECHNOLOGY,Confirm Your Participation
4,Technoworkers,SHAGUN SAXENA,ABES INSTITUTE OF TECHNOLOGY,Confirm Your Participation
"MSME-Development Institute, Kolkata",AB2,1,Ashwamedha,Atharva Kango,WALCHAND COLLEGE OF ENGINEERING,Confirm Your Participation
2,Maskoff,Ashish Kumar Sharma,JALPAIGURI GOVERNMENT ENGINEERING COLLEGE,Confirm Your Participation
3,CardioCoders,Sachin Prakash,DR. AKHILESH DAS GUPTA INSTITUTE OF TECHNOLOGY & MANAGEMENT,Confirm Your Participation
4,HYperX,Vishwas Lodhi,SAGAR INSTITUTE OF SCIENCE & TECHNOLOGY (SISTEC),Confirm Your Participation
"CTTC,Bhubaneswar",DR2,1,ESCALATOR,Achyuit Singh,CHAIBASA ENGINEERING COLLEGE (ESTD. BY GOVT. OF JHARKHAND & RUN BY TECHNO INDIA UNDER PPP),Confirm Your Participation
2,infinity eight,Prafful Silakari,LAKSHMI NARAIN COLLEGE OF TECHNOLOGY  & SCIENCE,Confirm Your Participation
3,KALANJIYAM,Krishna Priya Chandrasekaran,VELAMMAL ENGINEERING COLLEGE (ENGG. & TECH),Confirm Your Participation
4,Terminators-IT,SAKSHI JINNEWAR,"BAJAJ INSTITUTE OF TECHNOLOGY,",Confirm Your Participation
Chennai District Small Scale industries Association (CDISSIA),Th1,1,Coders__United,Vikyath Shetty,THADOMAL SHAHANI ENGINEERING COLLEGE,Confirm Your Participation
2,Cup O' Java,Niharika Kushwah,BANSAL INSTITUTE OF SCIENCE AND TECHNOLOGY,Confirm Your Participation
3,e-N0VAT0RZ,Rakesh Kumar Khetwal,DR. AKHILESH DAS GUPTA INSTITUTE OF TECHNOLOGY & MANAGEMENT,Confirm Your Participation
4,6 Kaizens,Harshit Garg,"Pandhi Dwarka Prasad Mishra Indian Institute of Information Technology & Manufacturing , Jabalpur",Confirm Your Participation
Chennai District Small Scale industries Association (CDISSIA),Th2,1,HETERODOX,AYUSHI AGGARWAL,BHARATI VIDYAPEETH'S INSTITUTE OF COMPUTER APPLICATIONS AND MANAGEMENT,Confirm Your Participation
2,Apeiron,Abhishek Kumar,LAKSHMI NARAIN COLLEGE OF TECHNOLOGY,Confirm Your Participation
3,Crack_It@code,Vignaan Vardhan,GURU NANAK INSTITUTIONS  TECHNICAL CAMPUS,Confirm Your Participation
4,INCOGNITO;,AMRITA MELWANI J,ST. JOSEPH'S COLLEGE OF ENGINEERING,Confirm Your Participation
Di Patna,"D,3",1,TEAM_SQUADRA,Rohith Reddy Vennam,IIT Hyderabad,Confirm Your Participation
2,VOLDEMORT,Pradeep Giri,"RAJASTHAN TECHNICAL UNIVERSITY, KOTA",Confirm Your Participation
3,To and Beyond Infinity,snehal Sonawane,SCTR'S PUNE INSTITUTE OF COMPUTER TECHNOLOGY,Confirm Your Participation
"D,4",1,The ScriptERR,Viraj Chatane,VISHWAKARMA INSTITUTE OF INFORMATION TECHNOLOGY,Confirm Your Participation
2,Ascension,Ashwini Patil,RAMRAO ADIK INSTITUTE OF TECHNOLOGY,Confirm Your Participation
3,Captivating Coders,Isha Krishna Shrivastava,SSBT'S COLLEGE OF ENGINEERING & TECHNOLOGY,Confirm Your Participation
4,Bumble-Bee,Garima Malhotra,INDIRA GANDHI DELHI TECHNICAL UNIVERSITY FOR WOMEN,Confirm Your Participation
"D,5",1,Wave@mlritm,Prajwal Nilopant,MARRI LAXMAN REDDY INSTITUTE OF TECHNOLOGY AND MANAGEMENT,Confirm Your Participation
2,CYBER WARRIORS S3HBV,Sakshi Pardeshi,K. K. WAGH INSTITUTE OF ENGINEERING EDUCATION & RESEARCH,Confirm Your Participation
3,Abhyudayaa,Kaivalya Mendki,WALCHAND COLLEGE OF ENGINEERING,Confirm Your Participation
4,Cipher crew,K. SHIVA TEJA,AURORA'S TECHNOLOGICAL AND RESEARCH INSTIUTE,Confirm Your Participation
"D,7",1,Code_Turrets,Arjun Bharti,MODEL INSTITUTE OF ENGINEERING AND TECHNOLOGY,Confirm Your Participation
2,Alpha Q,Aakash B,University College of Engineering Kancheepuram,Confirm Your Participation
3,TRIO,Shobhit Rajpal,CGC  COLLEGE OF ENGINEERING,Confirm Your Participation
4,Two-Third,Vikas Gola,Indian Institute of Technology Jammu,Confirm Your Participation
DIC Solan ,SN3,1,machhali eleven 360,Basant Kumar,"Indian Institute of Technology, Bhubaneshwar",Confirm Your Participation
2,Sherlock Holmes,Swarnalatha N,SRI RAMAKRISHNA ENGINEERING COLLEGE,Confirm Your Participation
Foundry Cluster Belgaum ,SU2,1,Ezerka,Ashfaq Nisar,VIDYA JYOTHI INSTITUTE OF TECHNOLOGY,Confirm Your Participation
2,Shield.,Vaibhav Pande,SHRI GURU GOBIND SINGHJI INSTITUTE OF ENGINEERING AND TECHNOLOGY,Confirm Your Participation
3,DESIKAR3,NAVEEN GANESAN,VALIVALAM DESIKAR POLYTECHNIC COLLEGE,Confirm Your Participation
4,NEBULA,Nayonika Chakraborty,GYAN GANGA INSTITUTE OF TECHNOLOGY & SCIENCES,Confirm Your Participation
Human Welfare Association Varanasi ,MR1,1,HYDRAS,Saurabh Arora,Jamia Millia Islamia University,Confirm Your Participation
2,Conference Room Automation,Snehal Karanjkar,SANGHAVI COLLEGE OF ENGINEERING,Confirm Your Participation
3,AZUKARIN,Swarika Bhosale,SIES GRADUATE SCHOOL OF TECHNOLOGY,Confirm Your Participation
Human Welfare Association Varanasi ,MR2,1,COD10TS,Dhananjay Gavade,DR. VISHWANATH KARAD MIT WORLD PEACE  UNIVERSITY,Confirm Your Participation
2,Augur Strides,Mounika Koduru,VELAGAPUDI RAMAKRISHNA SIDDHARTHA ENGINEERING COLLEGE,Confirm Your Participation
3,Kartavya,Yash Bonde,"National Institute of Technology, Raipur",Confirm Your Participation
4,The World Wide Webiverts,Pratik Akkole,"KLE DR. M. S. SHESHGIRI COLLEGE OF ENGINEERING AND TECHNOLOGY, BELGAUM",Confirm Your Participation
M/s Prescience Calibration Pvt Ltd ,MS1,1,Hack-O'-Holics,Abinash Panda,COLLEGE OF ENGINEERING AND TECHNOLOGY,Confirm Your Participation
2,Blue Grenade,sudhanshu shekhar,K.L.S. GOGTE INSTITUTE OF TECHNOLOGY,Confirm Your Participation
3,PUNCTUAL PROGRAMMERS,Anand Dubey,SCHOOL OF ENGINEERING AND TECHNOLOGY,Confirm Your Participation
4,Rigid Squad,Riddhesh Raval,VIDYA BHAWAN POLYTECHNIC COLLEGE,Confirm Your Participation
"M/s Saphire Media Services, Kaithal ",S1,1,Great_mates,MOHANKUMAR P,TAMILNADU COLLEGE OF ENGINEERING,Confirm Your Participation
2,Code Benders,Shivansh Mittal,MAHARAJA AGRASEN INSTITUTE OF TECHNOLOGY,Confirm Your Participation
3,Xcoders,Ishu Goel,FACULTY OF ENGINEERING MANAV RACHNA UNIVERSITY,Confirm Your Participation
4,CURIOUS DEVELOPERS,PAVITHRA R,SRI SAI RAM INSTITUTE OF TECHNOLOGY,Confirm Your Participation
MSME DEVELOPMENT INSTITUTE DELHI ,VK3,1,VIRTUOSO,TIWINKUMAR K,INFO INSTITUTE OF ENGINEERING,Confirm Your Participation
2,The-Errors,Avinash Jadhav,D.K.T.E. SOCIETY'S TEXTILE & ENGINEERING INSTITUTE,Confirm Your Participation
3,Incognitoos,Siddhant Padma,DR. VISHWANATH KARAD MIT WORLD PEACE  UNIVERSITY,Confirm Your Participation
MSME-DI Ahmedabad ,MP1,1,K-Compilers,Abdul Rehman Quadri,DEOGIRI INSTITUTE OF ENGINEERING AND MANAGEMENT STUDIES,Confirm Your Participation
2,Backstreet Hackers,ADITYA JOARDAR,RCC INSTITUTE OF INFORMATION TECHNOLOGY,Confirm Your Participation
3,Vocen Ameto,Sourav Ganguly,INTERNATIONAL INSTITUTE OF INFORMATION TECHNOLOGY BHUBANESWAR,Confirm Your Participation
4,TechnoCrypts,Tushar Raj Verma,ABES INSTITUTE OF TECHNOLOGY,Confirm Your Participation
"MSME-DI, CHENNAI ",KS2,1,PUMACOM,AKSHAT JAITLY,M. S. RAMAIAH INSTITUTE OF TECHNOLOGY,Confirm Your Participation
2,Squad Hackers,Amuthan D,K RAMAKRISHNAN COLLEGE OF TECHNOLOGY,Confirm Your Participation
3,Code_Gears_2019,Aditi Sinha,C.V.RAMAN COLLEGE OF ENGINEERING,Confirm Your Participation
4,HackTechs,Andria Maria Ajai,MUTHOOT INSTITUTE OF TECHNOLOGY AND SCIENCE,Confirm Your Participation
"MSME-DI, CHENNAI",VR2,1,Epsilons,Jayshri Gupta,ORIENTAL INSTITUTE OF SCIENCE & TECHNOLOGY,Confirm Your Participation
2,Nourishers,Aditya Patil,"GOVERNMENT COLLEGE OF ENGINEERING, AURANGABAD (ACADEMIC AUTONOMOUS)",Confirm Your Participation
Orissa,SS1,1,Team 21,Ajay Krishna A,K RAMAKRISHNAN COLLEGE OF TECHNOLOGY,Confirm Your Participation
2,Pop ups,Pravinkumar S,SRI KRISHNA COLLEGE OF ENGINEERING AND TECHNOLOGY,Confirm Your Participation
3,Squady Sixx,Hemant Jindal,"National Institute of Technology, Kurukshetra",Confirm Your Participation
4,Ode_to_code,Prerna Jain,MAHARAJA AGRASEN INSTITUTE OF TECHNOLOGY,Confirm Your Participation
"Nagar Nigam Jaipur, Govt. of Rajasthan",SV1,1,garbAGE,Saransh Poddar,"Symbiosis University of Applied Sciences, Indore",Confirm Your Participation
2,Team Renaissance,Mridul Chauhan,VELLORE INSTITUTE OF TECHNOLOGY,Confirm Your Participation
3,Itians_Coders,AJINKYA JAIN,PRIYADARSHINI BHAGWATI  COLLEGE OF ENGINEERING,Confirm Your Participation
4,THE MONAD ARMY,MIDHUNA V,ST. JOSEPH'S COLLEGE OF ENGINEERING,Confirm Your Participation
"NKSSIA, Hubli",MA1,1,Mindfreakz,Karvizhi G,ST. JOSEPH'S COLLEGE OF ENGINEERING,Confirm Your Participation
2,KRYPTONITE 2.0,ANANDU SREENIVASAN,MANGALAM COLLEGE OF ENGINEERING,Confirm Your Participation
3,NANDINI C27-Team,Madhira Nandhini,MALLA REDDY ENGINEERING COLLEGE FOR WOMEN,Confirm Your Participation
4,Daredevils,Prerna Binwade,WALCHAND COLLEGE OF ENGINEERING,Confirm Your Participation
"NKSSIA, Hubli",MA2,1,REB007,Chinmay Gawde,RIZVI COLLEGE OF ENGINEERING,Confirm Your Participation
2,Masgn Hack,ESWARA SUVARCHALA AKHILA YADLAPALLI,VASIREDDY VENKATADRI INSTITUTE OF TECHNOLOGY,Confirm Your Participation
3,Techno_Crypts,Harsh Namdev,"MEDI-CAPS UNIVERSITY, INDORE",Confirm Your Participation
4,Stoned_Coders,Ashutosh Singh,SHRI SHANKARACHARYA GROUP OF INSTITUTIONS,Confirm Your Participation
RAJDHANI,R.1,1,Cyber thug squad,Sushmitha Srikanth,Sri Ramakrishna College of Arts & Science for Women,Confirm Your Participation
2,Thanos 99,Fatema Phaltanwala,TRINITY COLLEGE OF ENGINEERING & RESEARCH,Confirm Your Participation
SARA SAE PVT LTD,SV1,1,SHRI ADHITHYA,KARTHIKEYAN S,M.KUMARASAMY COLLEGE OF ENGINEERING,Confirm Your Participation
2,Faiz Mohammed Ali,Faiz Mohammed Ali,THIAGARAJAR COLLEGE OF ENGINEERING,Confirm Your Participation
3,InfinityX,Siddhant Indave,"KARMAVEER KAKASAHEB WAGH POLYTECHNIC, NASHIK",Confirm Your Participation
4,TRANSWORKERS+,Mayur Satav,MIT ACADEMY OF ENGINEERING,Confirm Your Participation
SOLAN INDUSTRIAL ASSO.,SV1,1,SpecialChar,Sandeep Kumar,SHRI SANT GAJANAN MAHARAJ COLLEGE OF ENGINEERING,Confirm Your Participation
2,TECH HUNTER,Kalaiyarasi B,SRI KRISHNA COLLEGE OF ENGINEERING AND TECHNOLOGY,Confirm Your Participation
3,Ninja Tech,Sagar Basumatary,DON BOSCO COLLEGE OF ENGINEERING AND TECHNOLOGY,Confirm Your Participation
SOLAN INDUSTRIAL ASSO.,SV2,1,BESTECHZ,ANBARASU K,University College of Engineering Kancheepuram,Confirm Your Participation
2,Code_Amigos,Swetha Chaudhary,CHAITANYA BHARATHI INSTITUTE OF TECHNOLOGY,Confirm Your Participation
3,ITENTHUSIASTS,MANOJ KUMAR YADAV,"National Institute of Technology, Raipur",Confirm Your Participation
4,Void Abstractors,Mukkesh Ganesh,VELLORE INSTITUTE OF TECHNOLOGY CHENNAI OFF CAMPUS,Confirm Your Participation
DI CULCUTTA,AB2,1,The Saviour,Sandeep Kumar R,SRI VENKATESWARA COLLEGE OF ENGINEERING,Confirm Your Participation
2,CicadaCrackers,Rohit K Bharadwaj,"Birla Institute of Technology & Sciences, Pilani",Confirm Your Participation
3,SILVER LANTENS,SHRUTHI S,SSM INSTITUTE OF ENGINEERING AND TECHNOLOGY,Confirm Your Participation
ALTERENERGY Z,AL1,1,JEC Developers,Utkarsh Chauhan,"JABALPUR ENGINEERING COLLEGE,JABALPUR",Confirm Your Participation
2,UNSEEN FINESSE,KRISHNA S P,VELAMMAL COLLEGE OF ENGINEERING & TECHNOLOGY,Confirm Your Participation
3,BIOPLYN,Gautham G,MISRIMAL NAVAJEE MUNOTH JAIN ENGINEERING COLLEGE,Confirm Your Participation
4,Legion of Seekers,Arindam Pal,"ALL INDIA SHRI SHIVAJI MEMORIAL SOCIETY'S COLLEGE OF ENGINEERING, PUNE-1",Confirm Your Participation
"CITD, Hyderabad",GS1,1,LET US C#1729,Saumya Rastogi,KIET GROUP OF INSTITUTIONS,Confirm Your Participation
2,Game of Drones,Praveen Kumar M S,SRI SIVASUBRMANIYA NADAR COLLEGE OF ENGINEERING,Confirm Your Participation
3,CIPHERONS,Vijay Sankar V,THIAGARAJAR COLLEGE OF ENGINEERING,Confirm Your Participation
4,TEAM VAYU,karan shah,INSTITUTE OF TECHONOLOGY GOPESHWAR,Confirm Your Participation
GS2,1,Trojan_Code,Daibin Raju,"ST. JOSEPH'S COLLEGE OF ENGINEERING & TECHNOLOGY, PALAI",Confirm Your Participation
2,Nuts And Bolts,ARUN KUMAR S,ST. JOSEPH'S COLLEGE OF ENGINEERING,Confirm Your Participation
3,tEch nINjaas,Prathishta G,SRI RAMAKRISHNA ENGINEERING COLLEGE,Confirm Your Participation
4,SCRO-THREE,Sudharsan V,S.R. M INSTITUTE OF SCIENCE AND TECHNOLOGY,Confirm Your Participation
GS3,1,SJIT BUG SLAYERS,HARITHAA S,ST.JOSEPH'S INSTITUTE OF TECHNOLOGY,Confirm Your Participation
2,Dropulers,Akshay Kadav,PILLAI HOC POLYTECHNIC,Confirm Your Participation
3,Yan 2,Amay Verma,SHRI G.S.INSTITUTE OF TECH. & SCIENCE,Confirm Your Participation
4,Cyber_Gods,Tirumanpuri Rikshith,GEETHANJALI COLLEGE OF ENGINEERING AND TECHNOLOGY,Confirm Your Participation
GS4,1,Code Slayers,Tharun Atithya. S,ST. JOSEPH'S COLLEGE OF ENGINEERING,Confirm Your Participation
2,/*HELLO_ WORLD*/,JANVI IYER,GYAN GANGA COLLEGE OF TECHNOLOGY,Confirm Your Participation
3,Gems_Squad,Chitra Rajput,GYAN GANGA COLLEGE OF TECHNOLOGY,Confirm Your Participation
4,Krishna Ganpat Kadam,KRISHNA KADAM,CSMSS CHH. SHAHU COLLEGE OF ENGINEERING,Confirm Your Participation
"Consultant & Professor, DIT University, Dehradun",SA2,1,IDK,Nisha Mishra,INSTITUTE OF ENGINEERING AND TECHNOLOGY,Confirm Your Participation
2,The Denkers,Suraj Satankar,"JABALPUR ENGINEERING COLLEGE,JABALPUR",Confirm Your Participation
"CTTC, Bhuwaneswar",DR1,1,InnovationTycoons,Harshit Jaiswal,GYAN GANGA INSTITUTE OF TECHNOLOGY & SCIENCES,Confirm Your Participation
,,2,Back Space,Roshan Bhat,AMRITA VISWA VIDYAPEETHAM,Confirm Your Participation
,,3,MAC3S,Simranjit Singh Bedi,DON BOSCO COLLEGE OF ENGINEERING AND TECHNOLOGY,Confirm Your Participation
,,4,Bro-grammers,SIDDHARTH SAKTHIVEL,COIMBATORE INSTITUTE OF TECHNOLOGY,Confirm Your Participation
"CTTC, Bhuwaneswar",MR1,1,Navic,Harshitha K,DAYANANDA SAGAR UNIVERSITY,Confirm Your Participation
,,2,DOMINATION,ARIBA MEV,LAKSHMI NARAIN COLLEGE OF TECHNOLOGY  & SCIENCE,Confirm Your Participation
,,3,Dexterous_Squad,Mohammed Azib,B. P. PODDAR INSTITUTE OF MANAGEMENT & TECHNOLOGY,Confirm Your Participation
,,4,HyperCube,ASWIN A,"DEPARTMENT OF COMPUTER SCIENCE, COCHIN UNIVERSITY OF SCIENCE AND TECHNOLOGY",Confirm Your Participation
"Dharwad Growth Inds Association, Belur",HU1,1,CodeBusters6,Pratyksha Sharma,"National Institute of Technology, Raipur",Confirm Your Participation
,,2,coding.Studio();,Kunal Dubey,VIGNANA BHARATHI INSTITUTE OF TECHNOLOGY,Confirm Your Participation
,,3,Team Hypnos,Sahil Jha,"Amity University, Uttar Pradesh",Confirm Your Participation
,,4,Battle-Royals,Dayanidhee Singh,MAHARISHI MARKANDESHWAR ENGINEERING COLLEGE,Confirm Your Participation
"Dharwad Growth Inds Association, Belur",HU2,1,CODZILLA,ROSE MARY ABRAHAM,"MAR ATHANASIUS COLLEGE OF ENGINEERING, KOTHAMANGALAM",Confirm Your Participation
,,2,KIRA,Vikas Maurya,FR. C. RODRIGUES INSTITUTE OF TECHNOLOGY,Confirm Your Participation
,,3,Angry Nerds,Atul Sagotra,CGC  COLLEGE OF ENGINEERING,Confirm Your Participation
,,4,MINDHACKERS,PRINCE KUMAR SINGH,CH. BRAHM PRAKASH GOVERNMENT ENGINEERING COLLEGE,Confirm Your Participation
SKF India Ltd,RU5,1,DelhiCoders1.0,Navneet Saggu,DELHI TECHNOLOGICAL UNIVERSITY,Confirm Your Participation
2,TecKNext,Nitin Garg,MAHARAJA AGRASEN INSTITUTE OF TECHNOLOGY,Confirm Your Participation
3,Manan,Yashi Rai,"National Institute of Technology, Patna",Confirm Your Participation
4,You Know Who,Disha Bansal,NETAJI SUBHAS INSTITUTE OF TECHNOLOGY,Confirm Your Participation
Schneider Electric,NR4,1,Yodha,Sanket Tiwari,NITRA TECHNICAL CAMPUS,Confirm Your Participation
2,@Experimentals,Shreyas Sen,GYAN GANGA INSTITUTE OF TECHNOLOGY & SCIENCES,Confirm Your Participation
3,CODESQUAD#GEEKS,HIMANSHU GARG,"SWAMI KESHVANAND INSTITUTE OF TECHNOLOGY, MANAGEMENT & GRAMOTHAN",Confirm Your Participation
NR3,1,teslaForce,Sameer Thahir,"DEPARTMENT OF COMPUTER SCIENCE, COCHIN UNIVERSITY OF SCIENCE AND TECHNOLOGY",Confirm Your Participation
2,Callisto_06,Pranay Sharma,SHRI RAMDEOBABA COLLEGE OF ENGINEERING AND MANAGEMENT,Confirm Your Participation
3,Grafik Gott,Mahesh Kumar,"Sharda University, Gautam Budh Nagar",Confirm Your Participation
4,BLAZER,KANIKA GUPTA,ABES ENGINEERING COLLEGE,Confirm Your Participation
Student Inovation,AI14,1,ADIDAC,Amit Mandal,ACHARYA INSTITUTE OF TECHNOLOGY,Confirm Your Participation
2,The Unique,Sowmiya Velavane,SRI MANAKULA VINAYAGAR ENGINEERING COLLEGE,Confirm Your Participation
3,Aditi,Kontham Sravani,MAHATMA GANDHI INSTITUTE OF TECHNOLOGY,Confirm Your Participation
AI25,1,WeAreGroot,Gajendra Pratap Singh,"HARCOURT BUTLER TECHNICAL UNIVERSITY, KANPUR",Confirm Your Participation
AI2,1,Trail Blazer,Tolety Jayasree,VAAGDEVI COLLEGE OF ENGINEERING,Confirm Your Participation
2,techwarriors6,suriyaprabha m,SRI MANAKULA VINAYAGAR ENGINEERING COLLEGE,Confirm Your Participation
3,Rainbow warrior01,AKISHA ANTONY,G K M COLLEGE OF ENGINEERING AND TECHNOLOGY,Confirm Your Participation
AI24,1,Code Spear,AYUSHI KHANDELWAL,JAIPUR ENGINEERING COLLEGE AND RESEARCH CENTRE,Confirm Your Participation
2,Coder-X,Jayant Jain,BHAGWAN PARSHURAM INSTITUTE OF TECHNOLOGY,Confirm Your Participation
3,Ctrl Z,Arpit Jaiswal,"MEDI-CAPS UNIVERSITY, INDORE",Confirm Your Participation
4,Tricksters,Vishal Sinha,"National Institute of Technology, Karnataka",Confirm Your Participation
