3,Megabytes,Aaditya Verma,"The Northcap University, Gurgaon",Confirm Your Participation
4,Bits N'' Bytes,Vidhi Jain,INDIRA GANDHI DELHI TECHNICAL UNIVERSITY FOR WOMEN,Confirm Your Participation
Ministry of External Affairs,RK1,1,Cbaron,Rajatkumar Karmarkar,"Rajiv Gandhi College of Engineering and Research, Wanadongri",Confirm Your Participation
2,TapuSena,Rajshree Gavel,"National Institute of Technology, Raipur",Confirm Your Participation
3,Np_Complete!,Amit Tiwari,THAKUR COLLEGE OF ENGINEERING & TECHNOLOGY,Confirm Your Participation
4,SUPER USERS404,AVINASH A PANICKER,"ST. JOSEPH'S COLLEGE OF ENGINEERING & TECHNOLOGY, PALAI",Confirm Your Participation
RK2,1,BUG_HUNTER_SQUAD_!!,Deeksha Purohit,LAKSHMI NARAIN COLLEGE OF TECHNOLOGY EXCELLENCE,Confirm Your Participation
2,Lambda,Omkar Bahiwal,MAHARASHTRA INSTITUTE OF TECHNOLOGY,Confirm Your Participation
3,TEAM 101,Anjali Garg,NETAJI SUBHAS INSTITUTE OF TECHNOLOGY,Confirm Your Participation
4,Code_Brainiacs,Prathamesh Patade,PILLAI COLLEGE OF ENGINEERING,Confirm Your Participation
RK3,1,HRS4,Rudransh Srivastava,UNIVERSITY INSTITUTE OF ENGINEERING AND TECHNOLOGY,Confirm Your Participation
2,</IOstream>,Gurpreet Singh,UNIVERSITY INSTITUTE OF ENGINEERING AND TECHNOLOGY,Confirm Your Participation
3,TechNoobs,Shahanawaz Chachiya,ANJUMAN-I-ISLAM'S M. H. SABOO SIDDIK COLLEGE OF ENGINEERING,Confirm Your Participation
4,HEXCODER,Chetan Majithiya,MARWADI EDUCATION FOUNDATION'S GROUP OF INSTITUTIONS,Confirm Your Participation
RK4,1,TechCrewSVCE,Anurag Singhal,SWAMI VIVEKANAND COLLEGE OF ENGINEERING,Confirm Your Participation
2,Hexane,Prakhar Londhe,INSTITUTE OF ENGINEERING & TECHNOLOGY,Confirm Your Participation
3,THE CYBORGS,HEENA ODEDRA,"Techno India NJR Institute of Technology,Udaipur",Confirm Your Participation
4,TechGenies,Vinay C Patil,BAPUJI INSTITUTE OF ENGINEERING & TECHNOLOGY,Confirm Your Participation
Goldman Sachs,AM3,1,Techtycoons,Anudruti Singha,VELLORE INSTITUTE OF TECHNOLOGY,Confirm Your Participation
2,Error In Line 42,Chinmay NA,INDRAPRASTHA INSTITUTE OF INFORMATION TECHNOLOGY -DELHI (IIIT-D),Confirm Your Participation
3,LinkedList,Kopal Gupta,INDIRA GANDHI DELHI TECHNICAL UNIVERSITY FOR WOMEN,Confirm Your Participation
4,Cicada_3301.,Prantick Das,ASSAM ENGINEERING COLLEGE,Confirm Your Participation
AM2,1,Hexagonnerdzz,Akhil Raj,"Indian Institute of Technology, Kharagpur",Confirm Your Participation
2,Six Nearest Neighbors,Khyati Mahendru,DELHI TECHNOLOGICAL UNIVERSITY,Confirm Your Participation
3,Rapters,Shubham Kumar,"Sir M Visvesvaraya Institute of Technology, BANGALORE",Confirm Your Participation
4,The_Hexa_Squad,JAYASHREE G,MANAKULA VINAYAGAR INSTITUTE OF TECHNOLOGY,Confirm Your Participation
"ICAR, Ministry of Agriculture",SI1,1,ELITE INTELLECTS,NAVEEN KUMAR S,JEPPIAAR SRR ENGINEERING COLLEGE,Confirm Your Participation
2,KommandPrompt,Soumya Mohapatra,NETAJI SUBHAS INSTITUTE OF TECHNOLOGY,Confirm Your Participation
3,The Decoits,Rajat Sharma,SETH JAI PARKASH MUKAND LAL INSTITUTE OF ENGINEERING & TECHNOLOGY,Confirm Your Participation
4,The Bug Slayers JM,Sahil Sharma,SETH JAI PARKASH MUKAND LAL INSTITUTE OF ENGINEERING & TECHNOLOGY,Confirm Your Participation
Apollo Hospitals,GK5,1,Star Tech Troopers,Rahul Ravindra,VIDYAVARDHAKA COLLEGE OF ENGINEERING,Confirm Your Participation
2,TECHIPEDIA,SRIVARAPPRADHAN M,MANAKULA VINAYAGAR INSTITUTE OF TECHNOLOGY,Confirm Your Participation
3,imok,Rahul Meena,TRUBA COLLEGE OF SCIENCE & TECHNOLOGY,Confirm Your Participation
4,Sapphire Coders,Shashank J,SAI VIDYA INSTITUTE OF TECHNOLOGY,Confirm Your Participation
Adani Group,TU2,1,TechHat,Apoorva Saxena,"PES INSTITUTE OF TECHNOLOGY, BANGALORE SOUTH CAMPUS",Confirm Your Participation
2,Cosmos.,Shushank Shekhar,"PES INSTITUTE OF TECHNOLOGY, BANGALORE SOUTH CAMPUS",Confirm Your Participation
3,Cybor,Rohit Jain,"Indian Institute of Technology, Kharagpur",Confirm Your Participation
4,Fantastic Beasts,Dhruv Ramdev,DELHI TECHNOLOGICAL UNIVERSITY,Confirm Your Participation
,TU1,1,JAPNAS,Suraj Raka,DR. VISHWANATH KARAD MIT WORLD PEACE  UNIVERSITY,Confirm Your Participation
2,32BITS,Mihir Kumar Singh,"National Institute of Technology, Raipur",Confirm Your Participation
3,Cavity,Kunal Parihar,Indian Institute of Technology Jammu,Confirm Your Participation
AICH APPRAISERS AUCTIONERS AND VALUERS,IA1,1,Beginner's Luck Strikes,GOWTHAM SENTHIL,"INDIAN INSTITUTE OF TECHNOLOGY, TIRUPATI",Confirm Your Participation
2,NustaCoders,Rekha Panwar,GOVERNMENT ENGINEERING COLLEGE,Confirm Your Participation
3,WAFFWAFF_2.0,ROHIT TIDKE,SHRI SANT GAJANAN MAHARAJ COLLEGE OF ENGINEERING,Confirm Your Participation
4,AndroDigi,Jaya Rahedi,"WALCHAND INSTITUTE OF TECHNOLOGY, SOLAPUR",Confirm Your Participation
Bridgestone,SV2,1,CODE_IN_INDIA,Deepam Gupta,INSTITUTE OF ENGINEERING & TECHNOLOGY,Confirm Your Participation
2,Heavy Haulers,Vibha Prasad,VIDYAVARDHAKA COLLEGE OF ENGINEERING,Confirm Your Participation
3,Unique..,Salman Shaikh,K.C. COLLEGE OF ENGINEERING AND MANAGEMENT STUDIES AND RESEARCH,Confirm Your Participation
4,JUNIX 8080Ti,Mayur Tantwar,"JABALPUR ENGINEERING COLLEGE,JABALPUR",Confirm Your Participation
SV3,1,Artillery911,Dheeraj Bhosale,WALCHAND COLLEGE OF ENGINEERING,Confirm Your Participation
2,Tech1 Coders,Aishvarya G,PSG COLLEGE OF TECHNOLOGY,Confirm Your Participation
3,Celtics,Pradeep Kumar M.,SRI SIVASUBRMANIYA NADAR COLLEGE OF ENGINEERING,Confirm Your Participation
4,RunTime,Pallavi Sisodiya,VIDYALANKAR INSTITUTE OF TECHNOLOGY,Confirm Your Participation
SV1,1,Logic_Bomb,SAURABH PATEL,DELHI TECHNOLOGICAL UNIVERSITY,Confirm Your Participation
2,XKCD,DEEPANSHU RATHI,DELHI TECHNOLOGICAL UNIVERSITY,Confirm Your Participation
3,Until the Last Breath,AZHAR TALHA SYED,CMR COLLEGE OF ENGINEERING & TECHNOLOGY,Confirm Your Participation
4,Team Foobar,SRIPAAD SRINIVASAN,RAJALAKSHMI INSTITUTE OF TECHNOLOGY,Confirm Your Participation
ARAI,UK1,1,BroCode$,Vanitha Kunta,CHAITANYA BHARATHI INSTITUTE OF TECHNOLOGY,Confirm Your Participation
2,HackSlash,Shreyaskumar Bafna,TONTADARYA COLLEGE OF ENGINEERING,Confirm Your Participation
3,BE-SQUARD,RADHAKRISHNAN P,"PSNA COLLEGE OF ENGINEERING AND TECHNOLOGY , DINDIGUL",Confirm Your Participation
4,TheElite,Abinaya R,PANIMALAR ENGINEERING COLLEGE,Confirm Your Participation
UK2,1,Safe Driving,LOKESH BOTCHA,"Lendi Institute of Engineering & Technology, Jonnada (V), Denkada mandal, PIN- 535005 (CC-KD)",Confirm Your Participation
2,pheonix007,Vishali S,VELAMMAL COLLEGE OF ENGINEERING & TECHNOLOGY,Confirm Your Participation
3,BitByte,Paras Lakhani,MEERUT INSTITUTE OF ENGINEERING & TECHNOLOGY,Confirm Your Participation
4,Dream Slayers,HARSHIT MAHAJAN,NETAJI SUBHAS INSTITUTE OF TECHNOLOGY,Confirm Your Participation
UK5,1,advance alert,Subalakshmi S V,ST. JOSEPH'S COLLEGE OF ENGINEERING,Confirm Your Participation
2,The Dark Knights,Harshit Shrivastava,ORIENTAL COLLEGE OF TECHNOLOGY,Confirm Your Participation
3,Project_christopher,Nikhil Sonavane,VISHWAKARMA INSTITUTE OF TECHNOLOGY,Confirm Your Participation
4,RANSOMWARE,ASWARTH KANURI,VELAGAPUDI RAMAKRISHNA SIDDHARTHA ENGINEERING COLLEGE,Confirm Your Participation
UK4,1,shunya,Prajwal Chirde,MIT ACADEMY OF ENGINEERING,Confirm Your Participation
2,BETA UP YOUR MIND,HARIE VIGNESH B.K,AMRITA VISWA VIDYAPEETHAM,Confirm Your Participation
3,Augmenters,GSS RajKiran,GOKARAJU RANGARAJU INSTITUTE OF ENGINEERING & TECHNOLOGY(E&T),Confirm Your Participation
4,Bug Avengers,Bhimavarapu Sravya Pranati,VASIREDDY VENKATADRI INSTITUTE OF TECHNOLOGY,Confirm Your Participation
UK3,1,Techhack,Nishita Goyal,BHARATI VIDYAPEETH'S COLLEGE OF ENGINEERING,Confirm Your Participation
2,Callisto,Yeshwanth R,KONGUNADU COLLEGE OF ENGINEERING AND TECHNOLOGY,Confirm Your Participation
AGR Knowledge Services,RI2,1,Code Blooded Innovators,Mithil Dani,BHARATIYA VIDYA BHAVANS SARDAR PATEL INSTITUTE OF TECHNOLOGY,Confirm Your Participation
2,BITS_PLEASE,Darshan SK,"K S Institute of Technology, BANGALORE",Confirm Your Participation
3,Boom Shaka Laka,Abhishek Goel,MAHARAJA AGRASEN INSTITUTE OF TECHNOLOGY,Confirm Your Participation
Hindustan Unilever Ltd,RR3,1,Tech Enchantresses,Sangeerthana E,GSSS INSTITUTE OF ENGINEERING & TECHNOLOGY FOR WOMEN,Confirm Your Participation
2,CamCann_,Abhinav Gupta,VELLORE INSTITUTE OF TECHNOLOGY,Confirm Your Participation
3,CHRYSALIS_,Mehak Madan,PRIN. L.N. WELINGKAR INSTITUTE OF MANAGEMENT DEVELOPMENT & RESEARCH,Confirm Your Participation
4,HORCRUXX,Sushobhana Patra,"Dr. B. R. Ambedkar National Institute of Technology, Jalandhar",Confirm Your Participation
CDK,VM1,1,Acutus,Prarthna Adhikari,DR. AKHILESH DAS GUPTA INSTITUTE OF TECHNOLOGY & MANAGEMENT,Confirm Your Participation
2,SOCIAL VISIONERS (S.V.),Mayank Jindal,MEERUT INSTITUTE OF ENGINEERING & TECHNOLOGY,Confirm Your Participation
3,Innovators_A,Dhruv Gupta,JAYPEE INSTITUTE OF INFORMATION TECHNOLOGY,Confirm Your Participation
4,Fun In The Fog,Srishti Patil,K.L.S. GOGTE INSTITUTE OF TECHNOLOGY,Confirm Your Participation
VM3,1,Tesla36,Vikas NS,M. S. RAMAIAH INSTITUTE OF TECHNOLOGY,Confirm Your Participation
2,NUTMEG,Puneet Rajan,JSS ACADEMY OF TECHNICAL EDUCATION,Confirm Your Participation
3,Techie-Tribes,Prasad Thamada,"WELLFARE INSTITUTE OF SCIENCE, TECHNOLOGY AND MANAGEMENT",Confirm Your Participation
4,#CIPHERS,VINOD GUPTA,PILLAI COLLEGE OF ENGINEERING,Confirm Your Participation
VM4,1,Tesla2.0,Nancy Poddar,JSS ACADEMY OF TECHNICAL EDUCATION,Confirm Your Participation
2,Nirvana,Pooja Bharti,B I T SINDRI,Confirm Your Participation
3,Finity,Arpita Gonnade,SHRI SANT GAJANAN MAHARAJ COLLEGE OF ENGINEERING,Confirm Your Participation
4,ECO FRIENDS,RAGHU VARDHAN,CVR COLLEGE OF ENGINEERING,Confirm Your Participation
VM5,1,HelixDynamix,Manish Dixit,VIVEKANAND EDUCATION SOCIETY'S INSTITUTE OF TECHNOLOGY,Confirm Your Participation
2,ZERO+,Shubham Joshi,MIT ACADEMY OF ENGINEERING,Confirm Your Participation
3,Dawakhana Squad,Mokshith Nath Reddy Pyla,MAHATMA GANDHI INSTITUTE OF TECHNOLOGY,Confirm Your Participation
4,CoderArray,PRAVASH KUMAR BEHERA,C.V.RAMAN COLLEGE OF ENGINEERING,Confirm Your Participation
Tata Motors,ST5,1,DCSE_AVENGERS1,Mainak Chakraborty,DEFENCE INSTITUTE OF ADVANCED TECHNOLOGY,Confirm Your Participation
2,VSRS,Parameswar Panda,"Veer Surendra Sai University of Technology, Sambalpur",Confirm Your Participation
3,Abstrix,Abhijeet Nemade,PIMPRI CHINCHWAD EDUCATION TRUST'S PIMPRI CHINCHWAD COLLEGE OF ENGINEERING AND RESEARCH,Confirm Your Participation
4,KINEX,Joel Gee Roy,PROVIDENCE COLLEGE OF ENGINEERING,Confirm Your Participation
KG Infosystem Pvt. Ltd.,RV1,1,Potterheads,Amritha P Menon,SRI RAMAKRISHNA ENGINEERING COLLEGE,Confirm Your Participation
2,Team Pixel,Aniruddh Chandratre,SHRI VILE PARLE KELAVANI MANDALS NARSEE MONJEE INSTITUTE OF MANAGEMENT STUDIES DEEMED TO BE UNIVERSITY SVKMS NMIMS,Confirm Your Participation
3,Sacred Vibes,Harshal Borhade,MIT ACADEMY OF ENGINEERING,Confirm Your Participation
4,TECHDUDESS,DHEERAJ G.BHATT,JYOTHY INSTITUTE OF TECHNOLOGY,Confirm Your Participation
RV2,1,Cyber Hawk,Vipul Karande,"ALL INDIA SHRI SHIVAJI MEMORIAL SOCIETY'S COLLEGE OF ENGINEERING, PUNE-1",Confirm Your Participation
2,Sudo Coders,Soumya Koppaka,BHARATIYA VIDYA BHAVANS SARDAR PATEL INSTITUTE OF TECHNOLOGY,Confirm Your Participation
3,Enigmatics of NITK,Shubham Agrawal,"National Institute of Technology, Karnataka",Confirm Your Participation
4,Hyphen,Yogeshwar Madhavane,SRI MANAKULA VINAYAGAR ENGINEERING COLLEGE,Confirm Your Participation
RV3,1,undefined_,Vishal Raj A,ST. JOSEPH'S COLLEGE OF ENGINEERING,Confirm Your Participation
2,Tech-Tigers,Mihir Deodhar,BHARATIYA VIDYA BHAVANS SARDAR PATEL INSTITUTE OF TECHNOLOGY,Confirm Your Participation
3,Galileo Figaro,SOHAM DUTTA,UNIVERSITY OF HYDERABAD,Confirm Your Participation
4,The Originals V6,Lohit Bura,SETH JAI PARKASH MUKAND LAL INSTITUTE OF ENGINEERING & TECHNOLOGY,Confirm Your Participation
RV4,1,Return win,mukesh phulwani,SHRI SHANKARACHARYA GROUP OF INSTITUTIONS,Confirm Your Participation
2,Statement solvers,Keerthana P,ST.JOSEPH'S INSTITUTE OF TECHNOLOGY,Confirm Your Participation
3,Theranos,Anup Joseph,FR. CONCEICAO RODRIGUES COLLEGE OF ENGINEERING,Confirm Your Participation
4,TechLegionz,Needa Shaikh,ANJUMAN-I-ISLAM'S M. H. SABOO SIDDIK COLLEGE OF ENGINEERING,Confirm Your Participation
RV5,1,AGROBUZZ,Swapnil Damate,Symbiosis Skills and Open University,Confirm Your Participation
2,Botter,Ashutosh Hathidara,"Indian Institute of Information Technology, Design and Manufacturing",Confirm Your Participation
3,DevOps NIT,Ayush Jain,"National Institute of Technology, Raipur",Confirm Your Participation
4,Solvers_VIT,Arunbh Yashaswi,VELLORE INSTITUTE OF TECHNOLOGY CHENNAI OFF CAMPUS,Confirm Your Participation
RV6,1,INOVATIE HUB,KAMALESH KUMAR M.G,ST. JOSEPH'S COLLEGE OF ENGINEERING,Confirm Your Participation
2,CATHARSIS,Kumar Chaitanya,MAHARISHI MARKANDESHWAR ENGINEERING COLLEGE,Confirm Your Participation
3,innovative people,JAYANTH SARMA K V N S,MADANAPALLE INSTITUTE OF TECHNOLOGY & SCIENCE,Confirm Your Participation
4,PROGRAM WARRIOR,Yogesh Suryawanshi,GOVERNMENT POLYTECHNIC AURANGABAD,Confirm Your Participation
RV7,1,Team Rebelz,Lalsingh Daswani,THEEM COLLEGE OF ENGINEERING,Confirm Your Participation
2,BugSqaushers,Shrikant Gautam,MGM'S COLLEGE OF ENGINEERING AND TECHNOLOGY,Confirm Your Participation
3,Wings_of_fire,Raghul M,R.M.K. ENGINEERING COLLEGE,Confirm Your Participation
4,Teleos,Harika Bandarupally,CHAITANYA BHARATHI INSTITUTE OF TECHNOLOGY,Confirm Your Participation
Pathirakha,HM1,1,FLEXIBITS,Guruprasad C,R.V. COLLEGE OF ENGINEERING,Confirm Your Participation
2,Kaizen6,Shubham Bansal,NETAJI SUBHAS INSTITUTE OF TECHNOLOGY,Confirm Your Participation
3,Ode To Code-1,Nimish Khurana,UNIVERSITY INSTITUTE OF ENGINEERING AND TECHNOLOGY,Confirm Your Participation
Maruti,NM1,1,Tech-Achievers,Rahul Balani,JIET COLLEGE OF ENGINEERING,Confirm Your Participation
2,The Interpreter,Vaibhav Kumar,NATIONAL INSTITUTE OF SCIENCE & TECHNOLOGY,Confirm Your Participation
3,Techonocrats007,Harsh Panchal,SAL INSTITUTE OF TECHNOLOGY & ENGINEERING RESEARCH,Confirm Your Participation
4,MahaInfraTech,Sushant Chalak,VIDYALANKAR INSTITUTE OF TECHNOLOGY,Confirm Your Participation
NM2,1,FooBar,Ishan Joshi,DR. VISHWANATH KARAD MIT WORLD PEACE  UNIVERSITY,Confirm Your Participation
2,Musketeers,Nithesh K G,PANIMALAR ENGINEERING COLLEGE,Confirm Your Participation
3,D-Cyphers101,Somya Goel,BHARATI VIDYAPEETH'S COLLEGE OF ENGINEERING,Confirm Your Participation
4,SmarTeX,Supravo Ghosh,ACHARYA INSTITUTE OF TECHNOLOGY,Confirm Your Participation
NM3,1,INVICTUS7,Rachit Shrivastava,COLLEGE OF TECHNOLOGY AND ENGINEERING,Confirm Your Participation
2,THE_FLASH,Karthikeyan S,THIAGARAJAR COLLEGE OF ENGINEERING,Confirm Your Participation
3,I/O Hackers,Tuba Ali,DELHI TECHNOLOGICAL UNIVERSITY,Confirm Your Participation
4,Bugbuster,Pranav Sharma,DELHI TECHNOLOGICAL UNIVERSITY,Confirm Your Participation
Max Healthcare,MH1,1,Xtreme Aces,Raj Chourasiya,GYAN GANGA INSTITUTE OF TECHNOLOGY & SCIENCES,Confirm Your Participation
2,GreatMates,Daniya Taj C.M,MADANAPALLE INSTITUTE OF TECHNOLOGY & SCIENCE,Confirm Your Participation
3,HONESTY,NIKITA RAMWANI,FACULTY OF PHARMACY,Confirm Your Participation
4,Tech Neophytes,Deepjyoti Roy,GYAN GANGA INSTITUTE OF TECHNOLOGY & SCIENCES,Confirm Your Participation
MH3,1,Code 9,Ameya Kale,"MIT Art, Design and Technology University, Pune",Confirm Your Participation
2,ProHackerZ,Shvetha A,SETHU INSTITUTE OF TECHNOLOGY,Confirm Your Participation
3,ZeroBug Crew,Ritika Verma,ABES INSTITUTE OF TECHNOLOGY,Confirm Your Participation
4,Sacred Coders,Jayesh Kukreja,DON BOSCO INSTITUTE OF TECHNOLOGY,Confirm Your Participation
CISCO,AM1,1,Vision Coders,Vrushang Patel,L. J. INSTITUTE OF ENGINEERING & TECHNOLOGY,Confirm Your Participation
2,Kamikazey!,Shubhank Saxena,THAPAR INSTITUTE OF ENGINEERING AND TECHNOLOGY,Confirm Your Participation
3,CODE 456788,Shubhani Pandey,BHARATI VIDYAPEETH'S COLLEGE OF ENGINEERING,Confirm Your Participation
4,NFinity,Aman Vishwakarma,GYAN GANGA INSTITUTE OF TECHNOLOGY & SCIENCES,Confirm Your Participation
AM2,1,Ferozepurwale,Nihal Singh,"Indian Institute of Technology, Mumbai",Confirm Your Participation
2,TechFreak,Spoorthy Kale,K.L.S. GOGTE INSTITUTE OF TECHNOLOGY,Confirm Your Participation
3,Team68,Hrishikesh Barman,GIRIJANANDA CHOWDHURY INSTITUTE OF MANAGEMENT AND TECHNOLOGY,Confirm Your Participation
4,JavaTheHutt,Shruthi Raju,M. S. RAMAIAH INSTITUTE OF TECHNOLOGY,Confirm Your Participation
AM3,1,TECH CONQUERORS,BODANKI PAVAN,SAGI RAMAKRISHNAM RAJU ENGINEERING COLLEGE,Confirm Your Participation
2,Brainstormers,Mehek Male,FR. CONCEICAO RODRIGUES COLLEGE OF ENGINEERING,Confirm Your Participation
3,Cognito,Aniket Kumar,NETAJI SUBHASH ENGINEERING COLLEGE,Confirm Your Participation
4,Champions_sam,Aman Pratap Singh,"Indian Institute of Technology, Bhubaneshwar",Confirm Your Participation
A.I.C.T.E,AI2,1,BIZARRECODERS,PRIYANKA PRIYADARSHINEE,PARALA MAHARAJA ENGINEERING COLLEGE,Confirm Your Participation
2,Galaxy100,Vartit Garg,MEERUT INSTITUTE OF ENGINEERING & TECHNOLOGY,Confirm Your Participation
3,SPARKSS,Chintha Sai Raj,ST.PETER'S ENGINEERING COLLEGE,Confirm Your Participation
4,CORTEX,RAJ RAVAL,SHAH AND ANCHOR KUTCHHI ENGINEERING COLLEGE,Confirm Your Participation
AI3,1,Deep learners,Nandhinee PR,SRI SIVASUBRMANIYA NADAR COLLEGE OF ENGINEERING,Confirm Your Participation
2,WYSIWYG,Yamini L,SRI SIVASUBRMANIYA NADAR COLLEGE OF ENGINEERING,Confirm Your Participation
3,The_Last_Benchers,NAVNEET SINGH,"National Institute of Technology, Kurukshetra",Confirm Your Participation
4,Womengineer,MANMEET KAUR,INDIRA GANDHI DELHI TECHNICAL UNIVERSITY FOR WOMEN,Confirm Your Participation
AI5,1,DSOSC,Basavarajeshwari Ambi,SAHYADRI COLLEGE OF ENGINEERING & MANAGEMENT,Confirm Your Participation
2,INEX,SHAIK KHAJA MOINUDDIN,CMR COLLEGE OF ENGINEERING & TECHNOLOGY,Confirm Your Participation
3,The Pushers,Harpinder Jot Singh,"Birla Institute of Technology & Sciences, Pilani",Confirm Your Participation
4,Droid Makers,AVINASH B,PANIMALAR ENGINEERING COLLEGE,Confirm Your Participation
AI6,1,Tech-Troop,Shruti Modi,MODEL INSTITUTE OF ENGINEERING AND TECHNOLOGY,Confirm Your Participation
2,Coding Predators,Ketaki Barde,PILLAI COLLEGE OF ENGINEERING,Confirm Your Participation
3,Codeologist,Ankit Saxena,MEERUT INSTITUTE OF TECHNOLOGY,Confirm Your Participation
4,EVERYONE DEVELOPER,Manisha Gupta,GANGA INSTITUTE OF TECHNOLOGY AND MANAGEMENT,Confirm Your Participation
Shantha Biotechnics Pvt. Ltd,JM1,1,CODE BREAKERS 01,Muskan Gupta,DAV INSTITUTE OF ENGINEERING & TECHNOLOGY,Confirm Your Participation
2,Snalturalysis,Vashi Dhankar,MAHARAJA AGRASEN INSTITUTE OF TECHNOLOGY,Confirm Your Participation
3,PLAYCON,Haripriya Goswami,C.K.PITHAWALA COLLEGE OF ENGG & TECHNOLOGY,Confirm Your Participation
4,ZOMBIE HAT,Farheen Chougle,THADOMAL SHAHANI ENGINEERING COLLEGE,Confirm Your Participation
MathWorks,AG1,1,The Deep Learners,Rohit Agrawal,SHIV NADAR UNIVERSITY,Confirm Your Participation
2,Y-N0ts!,Uma Arunachalam,SRI SIVASUBRMANIYA NADAR COLLEGE OF ENGINEERING,Confirm Your Participation
3,TECH NINJAS,KOPPARTI SAI SRINIVAS,R.M.K. ENGINEERING COLLEGE,Confirm Your Participation
4,Dronebolt,Siddhant Nikumbh,SCTR'S PUNE INSTITUTE OF COMPUTER TECHNOLOGY,Confirm Your Participation
AG3,1,LETHALCODERS,Varad More,FR. C. RODRIGUES INSTITUTE OF TECHNOLOGY,Confirm Your Participation
2,ANANT,HIMANSHU MANI TRIPATHI,"National Institute of Technology, Silchar",Confirm Your Participation
3,Code_Defenders,Phanindra T,RAGHU INSTITUTE OF TECHNOLOGY,Confirm Your Participation
4,Accidental Koderss,Kavya Nathan,SIES GRADUATE SCHOOL OF TECHNOLOGY,Confirm Your Participation
Max Healthcare,MH2,1,THE TRIUMPHANTS,HARIHARASUDHAN C,KNOWLEDGE INSTITUTE OF TECHNOLOGY,Confirm Your Participation
2,The Bug-Slayers,Akshat Kishore,MAHARAJA AGRASEN INSTITUTE OF TECHNOLOGY,Confirm Your Participation
3,Bioneers,Shubham Chaudhari,SCTR'S PUNE INSTITUTE OF COMPUTER TECHNOLOGY,Confirm Your Participation
4,Flip_Flops,Rishab Lamba,BHARATI VIDYAPEETH'S COLLEGE OF ENGINEERING,Confirm Your Participation
MH4,1,TrojanHorsesDelhi,Lakshay Arora,BHARATI VIDYAPEETH'S COLLEGE OF ENGINEERING,Confirm Your Participation
2,PioneersOfVision,Santhoshi K.S,THIAGARAJAR COLLEGE OF ENGINEERING,Confirm Your Participation
3,TrojanHorses17,Varun Chopra,BHARATI VIDYAPEETH'S COLLEGE OF ENGINEERING,Confirm Your Participation
4,Gravity,Varsha Singh,BHARATI VIDYAPEETH'S COLLEGE OF ENGINEERING,Confirm Your Participation
MH5,1,White Walker,Tanya Kaintura,NIIT UNIVERSITY,Confirm Your Participation
2,CODE_BUSTERS,SHUBHAM YADAV,POORNIMA COLLEGE OF ENGINEERING,Confirm Your Participation
3,Benzene_404,Jasdeep Singh Grover,K. J. SOMAIYA COLLEGE OF ENGINEERING,Confirm Your Participation
4,BrainReaders,ALLENKI RAMYA,"National Institute of Technology, Raipur",Confirm Your Participation
MH6,1,The Musketeers,Ratheeshwaraa Karthikeyan,M.A.M. College of Engineering and Technology,Confirm Your Participation
2,TURING TECH,T J SHASHANK UTHKARSH,RAJARAJESWARI COLLEGE OF ENGINEERING,Confirm Your Participation
3,Trojanz,Shourya Sharma,KARUNYA INSTITUTE OF TECHNOLOGY AND SCIENCES,Confirm Your Participation
4,Tech Access,Rachit Vashistha,JAIPUR ENGINEERING COLLEGE AND RESEARCH CENTRE,Confirm Your Participation
"ICAR, Ministry of Agriculture",SI2,1,Omega(6),Nikita Gandharva,GURU GOBIND SINGH INDRAPRASTHA UNIVERSITY,Confirm Your Participation
2,TeamQuinx,KANISHKAR M,THIAGARAJAR COLLEGE OF ENGINEERING,Confirm Your Participation
3,Webstiffy,Saurav Kumar,GLOBAL INSTITUTE OF TECHNOLOGY,Confirm Your Participation
4,GenZBytes,Lokeshwar Kumar T,ST.JOSEPH'S INSTITUTE OF TECHNOLOGY,Confirm Your Participation
ITC,RR1,1,TEAM_PHOENIX,PENCE MATARIA,"Indian Institute of Technology, Kanpur",Confirm Your Participation
2,Abhyuday NSKHD,Swami Patil,K. K. WAGH INSTITUTE OF ENGINEERING EDUCATION & RESEARCH,Confirm Your Participation
3,THE ECO WARRIORS,Prateesh R K,FR. C. RODRIGUES INSTITUTE OF TECHNOLOGY,Confirm Your Participation
4,DeadSec,Adarsh Pratik,C.V.RAMAN COLLEGE OF ENGINEERING,Confirm Your Participation
RR2,1,Bit Rebels 99,Krishna Arun Rajasekharuni,ACE ENGINEERING COLLEGE,Confirm Your Participation
2,Elite Coders Six,Atul Tiwari,"Dr. B. R. Ambedkar National Institute of Technology, Jalandhar",Confirm Your Participation
3,GauMitra,Mohit Tripathi,"Indian Institute of Technology (Indian School of Mines), Dhanbad",Confirm Your Participation
4,EXTERMIDATORS,SELVAKUMAR M,VELAMMAL INSTITUTE OF TECHNOLOGY,Confirm Your Participation
RR3,1,Why So Serious,Devashish Prasad,SCTR'S PUNE INSTITUTE OF COMPUTER TECHNOLOGY,Confirm Your Participation
2,CodeSmashers,Shirish Khairnar,DR. VISHWANATH KARAD MIT WORLD PEACE  UNIVERSITY,Confirm Your Participation
3,IroniQ,Shreya Kanungo,YESHWANTRAO CHAVAN COLLEGE OF ENGINEERING,Confirm Your Participation
4,Vision7718,Omkar Prabhune,"COLLEGE OF ENGINEERING, PUNE",Confirm Your Participation
RR4,1,Tech  Creed,Yash Gupta,DATTA MEGHE INSTITUTE OF ENGINEERING TECHNOLOGY AND RESEARCH,Confirm Your Participation
2,Crunchers,Chakshu Jain,MAHARISHI MARKANDESHWAR ENGINEERING COLLEGE,Confirm Your Participation
3,CodeForVision,Namandeep Singh,JAIPUR ENGINEERING COLLEGE AND RESEARCH CENTRE,Confirm Your Participation
4,The Spearheads,Leena Bhandari,SINHGAD INSTITUTE OF TECHNOLOGY AND SCIENCE,Confirm Your Participation
Hughes Systique,SS1,1,The Eagles,Sarah Sonje,BHARATIYA VIDYA BHAVANS SARDAR PATEL INSTITUTE OF TECHNOLOGY,Confirm Your Participation
2,Tech warriers,HarshaVardhan Nallamilli,GMR INSTITUTE OF TECHNOLOGY,Confirm Your Participation
3,Sigma Star,Jerome S,PANIMALAR ENGINEERING COLLEGE,Confirm Your Participation
4,BlockSmiths,Aniket Kumar,"MANIPAL UNIVERSITY, JAIPUR",Confirm Your Participation
BHARAT ELECTRONICS LIMITED,PS1,1,E=[MC]^2,KAUSHIK DAYABAR B,JEPPIAAR INSTITUTE OF TECHNOLOGY,Confirm Your Participation
2,Bug Pointers,Yuvraj Singh,ORIENTAL INSTITUTE OF SCIENCE & TECHNOLOGY,Confirm Your Participation
3,Cadyce,Muthukumar C,V V COLLEGE OF ENGINEERING,Confirm Your Participation
4,GEEKY ARMY,YASSIN XAVIOUR A,SRM TRP ENGINEERING COLLEGE,Confirm Your Participation
PS2,1,Brainica,PRATEEK RAWAT,LAKSHMI NARAIN COLLEGE OF TECHNOLOGY,Confirm Your Participation
2,WONDER BEES,MALAVIKA T,SRI SIVASUBRMANIYA NADAR COLLEGE OF ENGINEERING,Confirm Your Participation
3,Delta_VIT,Abhirupa Mitra,VELLORE INSTITUTE OF TECHNOLOGY,Confirm Your Participation
4,AVISHKAR,SREE BALAJI N S,SRI SAIRAM COLLEGE OF ENGINEERING,Confirm Your Participation
Cognizant,JY1,1,Team F5,Vishal Nechwani,SHRI SANT GAJANAN MAHARAJ COLLEGE OF ENGINEERING,Confirm Your Participation
2,404_ERROR,SIVA KRISHNA REDDY P,R.M.K. COLLEGE OF ENGINEERING AND TECHNOLOGY,Confirm Your Participation
3,Technologues,Priya Gupta,INDIRA GANDHI DELHI TECHNICAL UNIVERSITY FOR WOMEN,Confirm Your Participation
4,Tech warriors 2k19,PRIYA SG,R.M.K. COLLEGE OF ENGINEERING AND TECHNOLOGY,Confirm Your Participation
JY2,1,Airavata,Vasnth S,PANIMALAR ENGINEERING COLLEGE,Confirm Your Participation
2,Hacking Bad,Poojan Turakhia,BHARATIYA VIDYA BHAVANS SARDAR PATEL INSTITUTE OF TECHNOLOGY,Confirm Your Participation
3,Innovation Skyline.,Avneet Kaur,Khalsa College for Women Amritsar,Confirm Your Participation
4,The Sinister-6,Kaustubh Murumkar,JAYAWANTRAO SAWANT COLLEGE OF ENGINEERING,Confirm Your Participation
JY3,1,TRAILBLAZERS_78,Shubham Karande,ATHARVA COLLEGE OF ENGINEERING,Confirm Your Participation
2,HOKAGECLAN,Naman Sisodia,COLLEGE OF TECHNOLOGY AND ENGINEERING,Confirm Your Participation
3,SCORPIONS X,DEEBIGA K,SRI MANAKULA VINAYAGAR ENGINEERING COLLEGE,Confirm Your Participation
4,FOSTER FILLERS,MANUEL JERRY I,ST. JOSEPH'S COLLEGE OF ENGINEERING,Confirm Your Participation
JY4,1,Spyder6,Rajkumar Vaghashiya,SCHOOL OF TECHNOLOGY (THE CONSTITUENT SCHOOL PANDIT DEENDAYAL PETROLEUM UNIVERSITY),Confirm Your Participation
2,Team Dexter,Shubham Dasarwar,VIDYALANKAR INSTITUTE OF TECHNOLOGY,Confirm Your Participation
3,TECH JARGONS,AISHWARIYA E,ST. JOSEPH'S COLLEGE OF ENGINEERING,Confirm Your Participation
