Company Name,PS Code,Shortlisted teams for Grand Finale
S.No,Team Name,Team Leader Name,College Name of Shortlisted Team,Action
ABB GIS Pvt Ltd,BP1,1,eGyaanYoddha,Nehal Kalnad,FR. CONCEICAO RODRIGUES COLLEGE OF ENGINEERING,Confirm Your Participation
2,Team WebDroid,Sagar Mistry,UNIVERSAL COLLEGE OF ENGINEERING,Confirm Your Participation
3,PU_TECHFIRE,Hanu Goyal,UNIVERSITY INSTITUTE OF ENGINEERING AND TECHNOLOGY,Confirm Your Participation
4,AVENGE,Dinesh Kumar Amara,AMRITA VISWA VIDYAPEETHAM,Confirm Your Participation
BP2,1,Skywalker,Rahul Tiwari,"Indian Institute of Technology, Bhubaneshwar",Confirm Your Participation
2,Spybot,NARENDRA NIMBALKAR,GYAN GANGA COLLEGE OF TECHNOLOGY,Confirm Your Participation
3,REIED,Aravind Balakrishnan,"MAR ATHANASIUS COLLEGE OF ENGINEERING, KOTHAMANGALAM",Confirm Your Participation
4,Make it app'n,Shivam Grover,BHARATI VIDYAPEETH'S COLLEGE OF ENGINEERING,Confirm Your Participation
BP3,1,Jagisa,Indira Pimpalkhare,DR. VISHWANATH KARAD MIT WORLD PEACE  UNIVERSITY,Confirm Your Participation
2,Slytherine,Mayank Prasad Khali,INSTITUTE OF TECHONOLOGY GOPESHWAR,Confirm Your Participation
3,YELLOVE3,Rishickesh Ramesh,SRI SIVASUBRMANIYA NADAR COLLEGE OF ENGINEERING,Confirm Your Participation
4,Creators for society,Takkla sainath reddy,ANURAG COLLEGE OF ENGINEERING,Confirm Your Participation
BP4,1,NIRATYAYA,SHREYASI SOM,"Indian Institute of Technology, Kanpur",Confirm Your Participation
2,COLLABRATORS,SHRISHTI RAI,GYAN GANGA INSTITUTE OF TECHNOLOGY & SCIENCES,Confirm Your Participation
3,ElectroGigzzz,Kavya S,SRI SAI RAM ENGINEERING COLLEGE,Confirm Your Participation
4,GRYFFINDORSCCE,THANGALLAPALLI THEJA,SREE CHAITANYA COLLEGE OF ENGINEERING,Confirm Your Participation
Apollo Hospitals,GK3,1,Double Helix,Shravan Bhat,"K S Institute of Technology, BANGALORE",Confirm Your Participation
2,ALT f4,Sanjay Singh Bhandari,BHILAI INSTITUTE OF TECHNOLOGY,Confirm Your Participation
3,Coding Demons JM,Ayush Madan,SETH JAI PARKASH MUKAND LAL INSTITUTE OF ENGINEERING & TECHNOLOGY,Confirm Your Participation
4,Bombe,Chinmay Chandak,SIES GRADUATE SCHOOL OF TECHNOLOGY,Confirm Your Participation
BEML,BL1,1,Positive Minds,Vishwas Modanwal,Indian Institute of Technology Jammu,Confirm Your Participation
2,HACKTRICKS,Pavan Kumar M,SRI SAIRAM COLLEGE OF ENGINEERING,Confirm Your Participation
3,Team Racemates,Pranav Reddy,Indian Institute of Technology Jammu,Confirm Your Participation
4,Team HackElite,Abhinav Thakur,VELLORE INSTITUTE OF TECHNOLOGY,Confirm Your Participation
BL4,1,BROGRAMMMERS,Younus Shaik,SATHYABAMA INSTITUTE OF SCIENCE AND TECHNOLOGY,Confirm Your Participation
2,THE LOSERS!,Mratyunjay Soni,"INDIAN INSTITUTE OF INFORMATION TECHNOLOGY, UNA",Confirm Your Participation
3,DREAMERS_36797,TUSHAR RAI,"National Institute of Technology, Karnataka",Confirm Your Participation
4,Tab Spaced Coders,Chintan Popat,UNIVERSAL COLLEGE OF ENGINEERING,Confirm Your Participation
BL5,1,Team Photon,T R Rohith,S.R. M INSTITUTE OF SCIENCE AND TECHNOLOGY,Confirm Your Participation
2,Code_Blooded 007,Yash Gaidhani,G.H.RAISONI COLLEGE OF ENGINEERING & MANAGEMENT,Confirm Your Participation
3,ECE Geeks,Priyanshu Tiwari,"Motilal Nehru National Institute of Technology, Allahabad",Confirm Your Participation
4,Star dust,Taran Rishit Undru,GOKARAJU RANGARAJU INSTITUTE OF ENGINEERING & TECHNOLOGY(E&T),Confirm Your Participation
Goonj,AJ1,1,What_The_Hack,Nidheesh Pandey,"Indian Institute of Information Technology, Allahabad",Confirm Your Participation
2,Tech Talks,Durga Prasad Patlolla,CHAITANYA BHARATHI INSTITUTE OF TECHNOLOGY,Confirm Your Participation
3,Rockin Robos,Kavita Rawat,"HARYANA ENGINEERING COLLEGE,JAGADHRI",Confirm Your Participation
4,SPECS CODERS,Ayush Rajak,GYAN GANGA INSTITUTE OF TECHNOLOGY & SCIENCES,Confirm Your Participation
AJ2,1,THE_SHIELD,Vipin Yadav,BUNDELKHAND INSTITUTE OF ENGINEERING & TECHNOLOGY JHANSI,Confirm Your Participation
2,PARAMNet,Sachin Ujjainkar,"North Maharashtra University, Jalgaon",Confirm Your Participation
3,Steven's Clan,Pushpane Singh Choudary,"Teerthanker Mahaveer University, Moradabad",Confirm Your Participation
4,Wellocity,Vijit Shrivastava,LAKSHMI NARAIN COLLEGE OF TECHNOLOGY,Confirm Your Participation
AJ3,1,AccheDin,Aneesh Kulkarni,VIVEKANAND EDUCATION SOCIETY'S INSTITUTE OF TECHNOLOGY,Confirm Your Participation
2,Tech Warriors-76,Vivek Saxena,INSTITUTE OF MANAGEMENT STUDIES (MCA),Confirm Your Participation
3,Aries,Mohit Jain,GYAN GANGA INSTITUTE OF TECHNOLOGY & SCIENCES,Confirm Your Participation
4,Braniacs,Aditi Rathore,ARYA COLLEGE OF ENGINEERING & INFORMATION TECHNOLOGY,Confirm Your Participation
Greefi,MU1,1,Anything,Neel Shah,K. J. SOMAIYA COLLEGE OF ENGINEERING,Confirm Your Participation
2,Luminaries,Atharva Udapure,SHRI RAMDEOBABA COLLEGE OF ENGINEERING AND MANAGEMENT,Confirm Your Participation
3,Alpha Vibe,Jatin Sahu,"BHILAI INSTITUTE OF TECHNOLOGY,RAIPUR.",Confirm Your Participation
4,Crypto Creds,Naga Anjaneyulu Katika,TKR COLLEGE OF ENGINEERING & TECHNOLOGY,Confirm Your Participation
HCL,K01,1,6_Pixels,Abhishek Shukla,"INDIAN INSTITUTE OF INFORMATION TECHNOLOGY, KALYANI",Confirm Your Participation
2,n-dimensionalBytes,Lovetesh .,BHARATI VIDYAPEETH'S COLLEGE OF ENGINEERING,Confirm Your Participation
3,NowWeSeeYou,Suriyakishore K S,ST. JOSEPH'S COLLEGE OF ENGINEERING,Confirm Your Participation
4,Cyber Punk,Arjun S,Lovely Professional University,Confirm Your Participation
India Health Link Pvt Ltd,RB2,1,AccuPose,Dhruv Rohatgi,MANAV RACHNA INTERNATIONAL INSTITUTE OF RESEARCH AND STUDIES,Confirm Your Participation
2,Posturize,Pruthvi Raj R G,"Indian Institute of Technology, Chennai",Confirm Your Participation
3,Terabyte,Vedant Rai,"National Institute of Technology, Raipur",Confirm Your Participation
4,Outbreakers,Shuba shri v,SRI RAMAKRISHNA ENGINEERING COLLEGE,Confirm Your Participation
RB3,1,CodeTempest,Aditya Agrawal,University of Delhi,Confirm Your Participation
2,ZERO-GRAVITY DEVELOPERS,Sri Vardhamanan A,SRI VENKATESWARA COLLEGE OF ENGINEERING,Confirm Your Participation
3,Binary_Bombers,Rahul Suresh,S.R. M INSTITUTE OF SCIENCE AND TECHNOLOGY,Confirm Your Participation
4,Kul Stuff,Shreyansh Rana,THAPAR INSTITUTE OF ENGINEERING AND TECHNOLOGY,Confirm Your Participation
IndiaNeoDesign,AR1,1,dare_devils,Nitin Sharma,JALPAIGURI GOVERNMENT ENGINEERING COLLEGE,Confirm Your Participation
2,STALWART'S,SRAVYA SREE DHULIPALA,SREENIDHI INSTITUTE OF SCIENCE & TECHNOLOGY,Confirm Your Participation
3,Cosmonauts,Pranav Bhardwaj,Maharaja Surajmal Institute,Confirm Your Participation
4,cAPSLOCK,Kanishk Tiwari,INSTITUTE OF ENGINEERING & TECHNOLOGY,Confirm Your Participation
AR3,1,INVICT,Dhriti Saini,INDIRA GANDHI DELHI TECHNICAL UNIVERSITY FOR WOMEN,Confirm Your Participation
2,Team BOT,Kishan Kanakhara,L. J. INSTITUTE OF ENGINEERING & TECHNOLOGY,Confirm Your Participation
3,the_white_walkers,Anishka Gupta,"National Institute of Technology, Hamirpur",Confirm Your Participation
4,M.TECH ROOKIES,Atal Sharma,CENTRAL UNIVESITY OF JAMMU,Confirm Your Participation
Dalmia Cement,SP1,1,VP GEEKS,Mudassir Mandviwala,VIDYALANKAR POLYTECHNIC,Confirm Your Participation
2,Y-Not!,Khair unnisa Begum,GOKARAJU RANGARAJU INSTITUTE OF ENGINEERING & TECHNOLOGY(E&T),Confirm Your Participation
3,THE-SQUAD,ARAVIND P,KARPAGAM INSTITUTE OF TECHNOLOGY,Confirm Your Participation
4,Sky Line,Aakash Sinha,BHARATI VIDYAPEETH'S INSTITUTE OF COMPUTER APPLICATIONS AND MANAGEMENT,Confirm Your Participation
Ministry of Culture,SS1,1,Team Mavericks,Abhishek Shah,PUNE VIDYARTHI GRIHA'S COLLEGE OF ENGINEERING AND TECHNOLOGY,Confirm Your Participation
2,HEXATO,Ayush Thakur,NETAJI SUBHASH ENGINEERING COLLEGE,Confirm Your Participation
3,Hashtech,Shubham Shrivastava,GYAN GANGA INSTITUTE OF TECHNOLOGY & SCIENCES,Confirm Your Participation
4,TechnoTitans,Swati Singh,"Amity University, Uttar Pradesh",Confirm Your Participation
SS2,1,TechEd,Sudhanjali Sethi,University of Delhi,Confirm Your Participation
2,PySociety,Yash Raj Sarrof,MANIPAL INSTITUTE OF TECHNOLOGY,Confirm Your Participation
3,Imps,Gurtej Singh Rehal,JALPAIGURI GOVERNMENT ENGINEERING COLLEGE,Confirm Your Participation
4,Linguistic Pandas,Abhishek Popli,MAHARAJA AGRASEN INSTITUTE OF TECHNOLOGY,Confirm Your Participation
Dell EMC,MR2,1,Indian Ascendancy Programmers,Hepzibah S,JEPPIAAR SRR ENGINEERING COLLEGE,Confirm Your Participation
2,Wingineeers,Saket Suman,"National Institute of Technology, Silchar",Confirm Your Participation
3,Pegasis 2.0,Subhasri Rallabandi,CHAITANYA BHARATHI INSTITUTE OF TECHNOLOGY,Confirm Your Participation
4,Team_ASPIRANTS,Aman Gupta,SHRI SANT GAJANAN MAHARAJ COLLEGE OF ENGINEERING,Confirm Your Participation
SSEPL Skills Pvt Ltd,RA1,1,Code_Wizards,Madhura Patwardhan,SHRI SANT GAJANAN MAHARAJ COLLEGE OF ENGINEERING,Confirm Your Participation
2,SUPERLATIVES2019,Shankar Chakraborty,FUTURE INSTITUTE OF ENGINEERING AND MANAGEMENT,Confirm Your Participation
3,Code_Crunch,Mahesh Mahajan,PILLAI COLLEGE OF ENGINEERING,Confirm Your Participation
4,Hackgnomes,Somoshri Ghosh,FUTURE INSTITUTE OF ENGINEERING AND MANAGEMENT,Confirm Your Participation
RA2,1,Heisenbug_404,Ruchira Gaikwad,PIMPRI CHINCHWAD COLLEGE OF ENGINEERING,Confirm Your Participation
2,int Elligents,Sharique Shaikh,ANJUMAN-I-ISLAM'S M. H. SABOO SIDDIK COLLEGE OF ENGINEERING,Confirm Your Participation
3,ManoRek,Sri Ram Gude,BAPATLA ENGINEERING COLLEGE,Confirm Your Participation
4,Coders Vibes,Shailina Jain,MODERN INSTITUTE OF TECHNOLOGY & RESEARCH CENTRE,Confirm Your Participation
Aurbindo Pharma,SK6,1,ElectroWarriors99,Shivam Saini,BHARATI VIDYAPEETH'S COLLEGE OF ENGINEERING,Confirm Your Participation
2,Dropout,Jayesh Jain,MAHINDRA ECOLE  CENTRALE,Confirm Your Participation
3,OrderTheChaos,Priyank Mitra,THE LNM INSTITUTE OF INFORMATION TECHNOLOGY,Confirm Your Participation
4,Mixed Innovators,Animesh Jain,"Birla Institute of Technology & Sciences, Pilani",Confirm Your Participation
SK2,1,Debug_Starts_Here,Vinay Saurabh,SCHOOL OF ENGINEERING AND TECHNOLOGY,Confirm Your Participation
2,CASTOR,Kakoli Bhadra,SILIGURI INSTITUTE OF TECHNOLOGY,Confirm Your Participation
3,Lancelot,Divyashri S,VELAMMAL INSTITUTE OF TECHNOLOGY,Confirm Your Participation
4,Techno Hack'S,Bharani aswath M,BANNARI AMMAN INSTITUTE OF TECHNOLOGY,Confirm Your Participation
deAsra Foundation,RK1,1,LoremIpsum,Sabarinath S.,SCTR'S PUNE INSTITUTE OF COMPUTER TECHNOLOGY,Confirm Your Participation
2,Ctrl-Alt-D3l,Rahul Gond,ZAGDU SINGH CHARITABLE TRUST'S THAKUR POLYTECHNIC,Confirm Your Participation
3,Hex-coders,Tushar Gupta,BHILAI INSTITUTE OF TECHNOLOGY,Confirm Your Participation
4,The Hack Shack,Anmol Jain,CHAITANYA BHARATHI INSTITUTE OF TECHNOLOGY,Confirm Your Participation
RK2,1,Pax_Indiana,Arpit Shukla,"Indian Institute of Technology, Dharwad",Confirm Your Participation
2,Codierer,Bhakti Deshpande,MAHARSHI KARVE STREE SHIKSHAN SAMSTHA'S CUMMINS COLLEGE OF ENGINEERING FOR WOMEN,Confirm Your Participation
3,Code Stomp,Mayank Vamja,GOVERNMENT ENGINEERING COLLEGE,Confirm Your Participation
4,Pro_Digies,Pranit De,"INDIAN INSTITUTE OF INFORMATION TECHNOLOGY, KALYANI",Confirm Your Participation
RK3,1,ABACUS,Mrinal Raj,SIDDAGANGA INSTITUTE OF TECHNOLOGY,Confirm Your Participation
2,Techyons,Shasvat Jain,GYAN GANGA INSTITUTE OF TECHNOLOGY & SCIENCES,Confirm Your Participation
3,A2V,Nikhil Narwade,SCTR'S PUNE INSTITUTE OF COMPUTER TECHNOLOGY,Confirm Your Participation
4,Pied Piper Geeks,Adwait Bhope,PUNE VIDYARTHI GRIHA'S COLLEGE OF ENGINEERING AND TECHNOLOGY,Confirm Your Participation
Mix Org,CS1,1,BitWise,Chaitya Chheda,"Visvesvaraya National Institute of Technology, Nagpur",Confirm Your Participation
2,Captiosus,Daniyal Abbasi,Jamia Millia Islamia University,Confirm Your Participation
3,ByteHackers,Prachi Verma,INDIRA GANDHI DELHI TECHNICAL UNIVERSITY FOR WOMEN,Confirm Your Participation
4,Parking PANDAS,Aryan Mehra,"Birla Institute of Technology & Sciences, Pilani",Confirm Your Participation
Manipal Health Entreprise,AP1,1,404_Not_Found,Vishal Ludhrani,K.C. COLLEGE OF ENGINEERING AND MANAGEMENT STUDIES AND RESEARCH,Confirm Your Participation
2,< Squadron >,Mounika Maddala,"WELLFARE INSTITUTE OF SCIENCE, TECHNOLOGY AND MANAGEMENT",Confirm Your Participation
3,Dream Designer,Rohit Suryawanshi,MGM'S COLLEGE OF ENGINEERING AND TECHNOLOGY,Confirm Your Participation
4,MITiansSIX,Simran Singh,"MIT Art, Design and Technology University, Pune",Confirm Your Participation
AP2,1,Himani,Sweta Kabi,INTERNATIONAL INSTITUTE OF INFORMATION TECHNOLOGY BHUBANESWAR,Confirm Your Participation
2,PHOENIX OF GRYFFINDOR,SIDDHARTH DAYALWAL,BABARIA INSTITUTE OF TECHNOLOGY,Confirm Your Participation
3,Techno Thrones,Rajiv Chandrasekar,ST. JOSEPH'S COLLEGE OF ENGINEERING,Confirm Your Participation
4,PixelPals,Aravindan K,SRI MANAKULA VINAYAGAR ENGINEERING COLLEGE,Confirm Your Participation
Infosys,IN3,1,The Straw Hat Crew,Pooja G,R.M.K. ENGINEERING COLLEGE,Confirm Your Participation
2,D_CODER 4.0,Rahul Mahar,DELHI TECHNOLOGICAL UNIVERSITY,Confirm Your Participation
3,8080,Shashank Srivastava,DELHI TECHNICAL CAMPUS,Confirm Your Participation
4,</>vengers,Krunal Gediya,ATHARVA COLLEGE OF ENGINEERING,Confirm Your Participation
IN1,1,IDEATORS_22,Surbhi Khatri,SHRI RAMDEOBABA COLLEGE OF ENGINEERING AND MANAGEMENT,Confirm Your Participation
2,ACARAA,ARUNDHATHI B,R.M.K. COLLEGE OF ENGINEERING AND TECHNOLOGY,Confirm Your Participation
3,SCRO-TWO,Kajal Chourasia,S.R. M INSTITUTE OF SCIENCE AND TECHNOLOGY,Confirm Your Participation
4,Noobers,Pranjal Sharma,"ENGINEERING COLLEGE,AJMER",Confirm Your Participation
Mahindra & Mahindra (Farm EQ),MA2,1,EDIFIERS,SAURABH KUMAR,"GANDHI ENGIEERING COLLEGE(GEC, BHUBANESWAR)",Confirm Your Participation
2,NIGHA,Darahasini Biruduraju,JNTUH COLLEGE OF ENGINEERING,Confirm Your Participation
3,Why Axis?,Hardik Sharma,SHRI RAMDEOBABA COLLEGE OF ENGINEERING AND MANAGEMENT,Confirm Your Participation
4,Random-6,Kartik Chawda,K.J. SOMAIYA INSTITUTE OF ENGINEERING & INFORMATION TECHNOLOGY,Confirm Your Participation
MA3,1,CaraML,Arush Bartaria,NETAJI SUBHAS INSTITUTE OF TECHNOLOGY,Confirm Your Participation
2,Bandersnatch,Calvin Wynne,ST. JOSEPH'S COLLEGE OF ENGINEERING,Confirm Your Participation
3,PlaceHolder,Gunnika Batra,BHARATI VIDYAPEETH'S COLLEGE OF ENGINEERING,Confirm Your Participation
4,HAPKMS,Himesh Deept Singh Saluja,"AMITY UNIVERSITY, RAIPUR",Confirm Your Participation
Mahyco,SA1,1,Familia,Sejal Gupta,GURU GOBIND SINGH INDRAPRASTHA UNIVERSITY,Confirm Your Participation
2,NEPER,SAFWAN GHANEM,C.V.RAMAN COLLEGE OF ENGINEERING,Confirm Your Participation
3,ALBONIX,RAGAVENDRA ACHUTHAN,VELAMMAL ENGINEERING COLLEGE (ENGG. & TECH),Confirm Your Participation
4,The_Elites,Vishvajit Girase,DR. VISHWANATH KARAD MIT WORLD PEACE  UNIVERSITY,Confirm Your Participation
SA2,1,SINTAP,Trupti Deshpande,DR. VISHWANATH KARAD MIT WORLD PEACE  UNIVERSITY,Confirm Your Participation
2,NIMBUS,Namrata Londhe,JSPM'S RAJARSHI SHAHU COLLEGE OF ENGINEERING,Confirm Your Participation
3,Smart teenthinkers,Gayathri .G,RAJALAKSHMI INSTITUTE OF TECHNOLOGY,Confirm Your Participation
4,Versatile,Mohamed Sayyaf,VIDYA ACADEMY OF SCIENCE & TECHNOLOGY,Confirm Your Participation
Mahindra Electric,DA1,1,Alpha6,Sourabh Kumar,DR. AKHILESH DAS GUPTA INSTITUTE OF TECHNOLOGY & MANAGEMENT,Confirm Your Participation
2,Omegaa,Sunjana Ramana Chintala,JNTUH COLLEGE OF ENGINEERING HYDERABAD,Confirm Your Participation
3,Run for cause,SOURABH ZENDE,JAYAWANTRAO SAWANT COLLEGE OF ENGINEERING,Confirm Your Participation
4,FIREBIRD,PRANITHA M,R.M.K. ENGINEERING COLLEGE,Confirm Your Participation
Yamaha,LS1,1,Alpha_Interface,Ketki Salunkhe,ATHARVA COLLEGE OF ENGINEERING,Confirm Your Participation
2,Ursprung,Mitul Gautam,ABES INSTITUTE OF TECHNOLOGY,Confirm Your Participation
3,RITtechnocrats,Jayaprakashan A,RAJALAKSHMI INSTITUTE OF TECHNOLOGY,Confirm Your Participation
4,Why Nots,Dhanoosh Lakshman S,ST. JOSEPH'S COLLEGE OF ENGINEERING,Confirm Your Participation
LS2,1,Team Fortius,AYUSH DUBEY,"National Institute of Technology, Jamshedpur",Confirm Your Participation
2,AndroGuys,Rajat Jain,MAHARAJA AGRASEN INSTITUTE OF TECHNOLOGY,Confirm Your Participation
3,Bit Rebels27,Aditi Metkar,"PROGRESSIVE EDUCATION SOCIETY'S MODERN COLLEGE OF ENGINEERING, PUNE",Confirm Your Participation
4,NINJA-NOMADS@6,Nitish Shrivastava,"MUZAFFARPUR INSTITUTE OF TECHNOLOGY, MUZAFFARPUR",Confirm Your Participation
LS4,1,Bug_Virus,Vishnu Tej K,ATME COLLEGE OF ENGINEERING,Confirm Your Participation
2,THE MYSTIC CODERS,ANUJ SHARMA,JSPM'S RAJARSHI SHAHU COLLEGE OF ENGINEERING,Confirm Your Participation
3,BUG KILLER,Prayag Lehana,THAPAR INSTITUTE OF ENGINEERING AND TECHNOLOGY,Confirm Your Participation
4,ATAAKK,Mohammed Thanweer H.M,R.M.K. ENGINEERING COLLEGE,Confirm Your Participation
Kotak Mahindra,AG1,1,Silicon Tribe,Arbaz Khan,ST. FRANCIS INSTITUTE OF TECHNOLOGY (ENGG. COLLEGE),Confirm Your Participation
2,Codeoysters,PRANAV GURDITTA,University of Delhi,Confirm Your Participation
3,CASAMY CHATBOT,Amulya Reddy Konda,MATRUSRI ENGINEERING COLLEGE,Confirm Your Participation
4,tab_over_spaces,Rishabh Mishra,"Bennett University, Greater Noida",Confirm Your Participation
Plezmo,AP1,1,Avanguardia,Anmol Deshpande,SHRI RAMDEOBABA COLLEGE OF ENGINEERING AND MANAGEMENT,Confirm Your Participation
2,Convigators,Sanjai kuru K,SRI KRISHNA COLLEGE OF ENGINEERING AND TECHNOLOGY,Confirm Your Participation
3,Vision-Quest,SURAJ K M,JAYA ENGINEERING COLLEGE,Confirm Your Participation
4,TECHARMY_6,Akash Bajpai,KIET GROUP OF INSTITUTIONS,Confirm Your Participation
Future Generali,AK1,1,Optimum7,Anusurya .,BHARATI VIDYAPEETH'S COLLEGE OF ENGINEERING,Confirm Your Participation
2,<HackerJacks>,Nishita Malhotra,INDIRA GANDHI DELHI TECHNICAL UNIVERSITY FOR WOMEN,Confirm Your Participation
3,KINGPINS,SHABAZ KHAN,PRIYADARSHINI ENGINEERING COLLEGE,Confirm Your Participation
4,Tstar_A,Neel Kukreti,JAYPEE INSTITUTE OF INFORMATION TECHNOLOGY,Confirm Your Participation
AK2,1,MRDOTAPP,Anmol Bansal,MAHARAJA AGRASEN INSTITUTE OF TECHNOLOGY,Confirm Your Participation
2,BitCode,UMAPATHY B,"UNIVERSITY COLLEGE OF ENGINEERING, BITCAMPUS TIRUCHIRAPPALLI",Confirm Your Participation
3,The_End_Game,JAYDEEP GUBBA,CVR COLLEGE OF ENGINEERING,Confirm Your Participation
4,Vencedor,Shiva Tiwari,ABES INSTITUTE OF TECHNOLOGY,Confirm Your Participation
AK3,1,Get_CITfied,SHRI SARAN RAJ N,CHENNAI INSTITUTE OF TECHNOLOGY,Confirm Your Participation
2,Impetus,Aiman Meenai,"UNIVERSITY INSTITUTE OF TECHNOLOGY, RGPV, BHOPAL",Confirm Your Participation
3,Bug Slayers6,Bhagyasri Atukuri,"National Institute of Technology, Calicut",Confirm Your Participation
4,Finite Loops,Kshitij Phulare,BHARATIYA VIDYA BHAVANS SARDAR PATEL INSTITUTE OF TECHNOLOGY,Confirm Your Participation
ezDI,RG1,1,TeamCoders6,Paras Narendranath,B.M.S.COLLEGE OF ENGINEERING,Confirm Your Participation
2,Calm Down its just Genjutsu,Devasish Mahato,"INDIAN INSTITUTE OF INFORMATION TECHNOLOGY, PUNE",Confirm Your Participation
3,Six_layers_of_Neurons,Varan Singh Rohila,"National Institute of Technology, Hamirpur",Confirm Your Participation
4,ZeroBugg,Shivangi Kochhar,BHARATI VIDYAPEETH'S COLLEGE OF ENGINEERING,Confirm Your Participation
RG2,1,Convolution,Aman Daga,VEERMATA JIJABAI TECHNOLOGICAL INSTITUTE,Confirm Your Participation
2,THE_OUTLIERS,Apoorva Vikram Singh,"National Institute of Technology, Silchar",Confirm Your Participation
3,pySoul,SAI NIKHILA MUNIPALLE,"National Institute of Technology, Raipur",Confirm Your Participation
4,Tech-engers,Diksha Chhabra,JSS ACADEMY OF TECHNICAL EDUCATION,Confirm Your Participation
Thermo Fisher,KR1,1,Bits Please,Shubham Maynal,"GOVERNMENT COLLEGE OF ENGINEERING, AURANGABAD (ACADEMIC AUTONOMOUS)",Confirm Your Participation
2,Exponential,Dimpal Saluja,"National Institute of Technology, Patna",Confirm Your Participation
3,2b || !2b,Vibhor Gupta,DELHI TECHNOLOGICAL UNIVERSITY,Confirm Your Participation
4,Samaritans,Ashwin Patil,DR. VISHWANATH KARAD MIT WORLD PEACE  UNIVERSITY,Confirm Your Participation
KR2,1,Wild sredoC,Gayathri R,"PSNA COLLEGE OF ENGINEERING AND TECHNOLOGY , DINDIGUL",Confirm Your Participation
2,java_js,Varsha Kukreja,SCTR'S PUNE INSTITUTE OF COMPUTER TECHNOLOGY,Confirm Your Participation
3,Twisted Minds,Karthick Ramesh,MANAKULA VINAYAGAR INSTITUTE OF TECHNOLOGY,Confirm Your Participation
4,#the_brainiacs#,Mansi Nimje,PILLAI COLLEGE OF ENGINEERING,Confirm Your Participation
AGR Knowledge Services,RI1,1,UNTITLED_6542,Yash Sampat,MARWADI EDUCATION FOUNDATION'S GROUP OF INSTITUTIONS,Confirm Your Participation
2,The ERRORs_VESIT,Sanket Gokhale,VIVEKANAND EDUCATION SOCIETY'S INSTITUTE OF TECHNOLOGY,Confirm Your Participation
3,Tech Insiders Hub,Pratik Rane,MGM'S COLLEGE OF ENGINEERING AND TECHNOLOGY,Confirm Your Participation
4,Blitzkrieg.,Yogesh T S,"PES UNIVERSITY, BANGLORE",Confirm Your Participation
VANDERLANDE,SM3,1,MIT Innovation Geeks,Ameya Mahabaleshwarkar,DR. VISHWANATH KARAD MIT WORLD PEACE  UNIVERSITY,Confirm Your Participation
2,AwsomeCase,Mayank Sahu,SAGAR INSTITUTE OF RESEARCH & TECHNOLOGY,Confirm Your Participation
3,The Class Reapers,ANBU SURIYA K,MANAKULA VINAYAGAR INSTITUTE OF TECHNOLOGY,Confirm Your Participation
Department of Atomic Energy,RC1,1,3D Works,Shreevari SP,VIDYAVARDHAKA COLLEGE OF ENGINEERING,Confirm Your Participation
2,Hack Monsters,Akash Awasthi,KALASALINGAM ACADEMY OF RESEARCH AND EDUCATION,Confirm Your Participation
3,Project SarVik,Dwaraknath Gnaneshwar,MANIPAL INSTITUTE OF TECHNOLOGY,Confirm Your Participation
4,Phi Beta Kappa,Lakshay Bansal,"Indian Institute of Technology, Kharagpur",Confirm Your Participation
RC2,1,URJASV,Kumar Gaurav Singh,INSTITUTE OF ENGINEERING AND TECHNOLOGY,Confirm Your Participation
2,Pragya,Vishal Shrivastava,LAKSHMI NARAIN COLLEGE OF TECHNOLOGY,Confirm Your Participation
3,Syzygy,Heena Garg,MAHARAJA AGRASEN INSTITUTE OF TECHNOLOGY,Confirm Your Participation
4,O1,Prasoon Parashar,"National Institute of Technology, Patna",Confirm Your Participation
RC3,1,Hexa-Codie,Swati Kanchan,"National Institute of Technology, Durgapur",Confirm Your Participation
2,NeuralNets,Vaibhav Shukla,"INDIAN INSTITUTE OF INFORMATION TECHNOLOGY, KALYANI",Confirm Your Participation
3,Team Polynomial,ADARSH SHETTY,"NMAM INSTITUTE OF TECHNOLOGY, NITTE",Confirm Your Participation
4,Defaulting,Banipreet Singh Raheja,"Indian Institute of Technology (Indian School of Mines), Dhanbad",Confirm Your Participation
RC5,1,LifeBus,Smriti Sharma,"National Institute of Technology, Patna",Confirm Your Participation
2,OneByZero,Vaishali Khanve,"INDIAN INSTITUTE OF TECHNOLOGY, TIRUPATI",Confirm Your Participation
3,HashtagCoders,Shubhkirti Sharma,UNIVERSITY INSTITUTE OF ENGINEERING AND TECHNOLOGY,Confirm Your Participation
4,teamRocket,Jimit Bhatt,"G. H. RAISONI COLLEGE OF ENGINEERING, NAGPUR.",Confirm Your Participation
Samsung R&D,SS2,1,ECOVATIONN_4U,Atharva Kasangottuwar,SHRI RAMDEOBABA COLLEGE OF ENGINEERING AND MANAGEMENT,Confirm Your Participation
2,Tech Fanatic,Vaishnavi Harikanth,K.L.S. GOGTE INSTITUTE OF TECHNOLOGY,Confirm Your Participation
3,6 Sigma,Bhavya Chawla,BHARATI VIDYAPEETH DEEMED UNIVERSITY COLLEGE OF ENGINEERING,Confirm Your Participation
4,echo_Vega,Indranil Biswas,"National Institute of Technology, Agartala",Confirm Your Participation
Ministry of AYUSH,SH1,1,SONNSP,Somesh Wadnagra,DATTA MEGHE INSTITUTE OF ENGINEERING TECHNOLOGY AND RESEARCH,Confirm Your Participation
2,MINDBENDERS,KRITIKA DUTTA,MEERUT INSTITUTE OF ENGINEERING & TECHNOLOGY,Confirm Your Participation
3,SAI MEDICOS,Madhumathi V,"SRI SAIRAM SIDDHA MEDICAL COLLEGE & RESEARCH CENTRE (Inst. Code - 190), KANCHEEPURAM",Confirm Your Participation
4,Hack  'O'  Holics,Nimisha Mittal,MAHARAJA AGRASEN INSTITUTE OF TECHNOLOGY,Confirm Your Participation
SH2,1,Rogue Gladiators,Aayush Aggarwal,JSS ACADEMY OF TECHNICAL EDUCATION,Confirm Your Participation
2,Savage Coder,Aniket Vishal,ST. THOMAS' COLLEGE OF ENGINEERING & TECHNOLOGY,Confirm Your Participation
3,Bug2Debug,Mayank Sharma,"Guru  Jambheshwar University of Science and Technology, Hissar",Confirm Your Participation
4,SwiftPearl,Ankit Anand,TECHNO INDIA - BATANAGAR 332,Confirm Your Participation
SH3,1,GREENGINEERS,KARTHIGEYAN S,MANAKULA VINAYAGAR INSTITUTE OF TECHNOLOGY,Confirm Your Participation
2,Ticca,Palak Shah,SHRI VILE PARLE KELAVANI MANDAL'S DWARKADAS J. SANGHVI COLLEGE OF ENGINEERING,Confirm Your Participation
3,Untitled Folder,Jwngfu Brahma,MANAV RACHNA INTERNATIONAL INSTITUTE OF RESEARCH AND STUDIES,Confirm Your Participation
4,Esperanza,Bhavesh Mahale,PUNE VIDYARTHI GRIHA'S COLLEGE OF ENGINEERING AND TECHNOLOGY,Confirm Your Participation
SH4,1,Tech Dhronas,Shreya Sharma,MAHARAJA AGRASEN INSTITUTE OF TECHNOLOGY,Confirm Your Participation
2,The Sixth Error,Divya Jain,"Techno India NJR Institute of Technology,Udaipur",Confirm Your Participation
3,ReturnToSleep,Aman Jain,GYAN GANGA COLLEGE OF TECHNOLOGY,Confirm Your Participation
4,Burning Ashes,Sachin Matta,CHANDIGARH ENGINEERING COLLEGE,Confirm Your Participation
RCF,SP2,1,Clay,Antik Chattopadhyay,VELLORE INSTITUTE OF TECHNOLOGY,Confirm Your Participation
2,DEKU,Balu B,"Sri Venkateshwara College of Engineering, BANGALORE",Confirm Your Participation
3,Byte Walker,Sanskar Gupta,SAGAR INSTITUTE OF SCIENCE & TECHNOLOGY (SISTEC),Confirm Your Participation
4,Fix O'Krop,Raniyaharini R,SRI KRISHNA COLLEGE OF TECHNOLOGY,Confirm Your Participation
SP1,1,TECHNO-CRATS 3.O,SUBASHINI U,ST. JOSEPH'S COLLEGE OF ENGINEERING,Confirm Your Participation
2,Firebugz Predators,Manpreet Singh,UNIVERSITY INSTITUTE OF ENGINEERING AND TECHNOLOGY,Confirm Your Participation
3,Agronomists,Sanket Paratkar,VIVEKANAND EDUCATION SOCIETY'S INSTITUTE OF TECHNOLOGY,Confirm Your Participation
4,CaffeineOverflow,Megha S,BAPUJI INSTITUTE OF ENGINEERING & TECHNOLOGY,Confirm Your Participation
Hindustan Unilever Ltd,RR2,1,Seekers@SSN,Dyaneswaran Sivasankaran,SRI SIVASUBRMANIYA NADAR COLLEGE OF ENGINEERING,Confirm Your Participation
2,404 Team Found,Ranjithkumar R,SRI KRISHNA COLLEGE OF ENGINEERING AND TECHNOLOGY,Confirm Your Participation
