4,SPACEBOTICS,AKASH JOSEPH,VIJNAN INSTITUTE OF SCIENCE AND TECHNOLOGY (VISAT),Confirm Your Participation
JY8,1,Design_via_code,SHEFALI BANSAL,DELHI TECHNOLOGICAL UNIVERSITY,Confirm Your Participation
2,FitGit1.0,Vartul Bhardwaj,DELHI TECHNOLOGICAL UNIVERSITY,Confirm Your Participation
3,CodeAstronomy,LAVANYA B,"K S Institute of Technology, BANGALORE",Confirm Your Participation
4,CADBURY BYTES,SRIHARISH R,AMRITA SCHOOL OF ENGINEERING,Confirm Your Participation
JY9,1,Tech_Amigos,DISHA AGRAWAL,SHRI RAMDEOBABA COLLEGE OF ENGINEERING AND MANAGEMENT,Confirm Your Participation
2,CODESTERS#6,SOHAN CHOUGULE,TSSM'S BHIVARABAI SAWANT COLLEGE OF ENGINEERING AND RESEARCH,Confirm Your Participation
3,GhoulCoders,Rushikesh Jachak,"GOVERNMENT COLLEGE OF ENGINEERING, AURANGABAD (ACADEMIC AUTONOMOUS)",Confirm Your Participation
4,Green Datum,Tajasvi Kumar Singh,IIT Delhi,Confirm Your Participation
PayTM,SJ1,1,ThaaanthriC'$404,Manthan M Kulakarni,JSS SCIENCE AND TECHNOLOGY UNIVERSITY,Confirm Your Participation
2,Machine Works,Mexson Fernandes,ASIA PACIFIC INSTITUTE OF INFORMATION TECHNOLOGY SD INDIA PANIPAT,Confirm Your Participation
3,GecaToons,Saurabh Lodha,"GOVERNMENT COLLEGE OF ENGINEERING, AURANGABAD (ACADEMIC AUTONOMOUS)",Confirm Your Participation
4,OPTIMUS.,Dhruva Vatsa Mishra,CMR INSTITUTE OF TECHNOLOGY,Confirm Your Participation
SJ2,1,NullStop,Samridhi Maheshwari,SCTR'S PUNE INSTITUTE OF COMPUTER TECHNOLOGY,Confirm Your Participation
2,Navyakalpa,Shikhar Makhija,NETAJI SUBHAS INSTITUTE OF TECHNOLOGY,Confirm Your Participation
3,The mind install,Ria Khapekar,DR.D.Y.PATIL SCHOOL OF ENGINEERING AND TECHNOLOGY,Confirm Your Participation
4,infinite_loop06,Pragati Bansal,"JABALPUR ENGINEERING COLLEGE,JABALPUR",Confirm Your Participation
SJ3,1,HackCyS,Kamalesh Biswas,UNIVERSITY INSTITUTE OF TECHNOLOGY,Confirm Your Participation
2,THE BUG SLAYING TECHIES,GOWRESHANHARAN S,SRI SAI RAM INSTITUTE OF TECHNOLOGY,Confirm Your Participation
3,atri,vishal bidarkar,AURORA'S TECHNOLOGICAL AND RESEARCH INSTIUTE,Confirm Your Participation
4,Phishing Preventer,VINITHA K V,MADANAPALLE INSTITUTE OF TECHNOLOGY & SCIENCE,Confirm Your Participation
Everest Industries,KK1,1,{BYTE:ME},Aadish Jain,MAHARAJA AGRASEN INSTITUTE OF TECHNOLOGY,Confirm Your Participation
2,Accidental Engineers,Mayur Mhaske,FR. C. RODRIGUES INSTITUTE OF TECHNOLOGY,Confirm Your Participation
3,The Decoders,Ajay Kadam,SCTR'S PUNE INSTITUTE OF COMPUTER TECHNOLOGY,Confirm Your Participation
4,Youth Hustlers,Kishalini S,ST. JOSEPH'S COLLEGE OF ENGINEERING,Confirm Your Participation
KK2,1,Tech Tribe@6,Rachana Yeravelli,VNR VIGNANA JYOTHI INSTITUTE OF ENGINEERING & TECHNOLOGY,Confirm Your Participation
2,Tactics Crew 2019,ANUSHA S,ST. JOSEPH'S COLLEGE OF ENGINEERING,Confirm Your Participation
3,Team Mavr!ck_31,Vaibhav Batra,VISHWAKARMA INSTITUTE OF TECHNOLOGY,Confirm Your Participation
4,Keycoder,Abhinav Pandey,INSTITUTE OF ENGINEERING & TECHNOLOGY,Confirm Your Participation
KK5,1,RadarRiders@mlritm,Bandi Nikhill Reddy,MARRI LAXMAN REDDY INSTITUTE OF TECHNOLOGY AND MANAGEMENT,Confirm Your Participation
2,SNAAPP,Siddharth Gupta,IIT Hyderabad,Confirm Your Participation
3,Smart_Steelers,Sanket Atigal,"KLE DR. M. S. SHESHGIRI COLLEGE OF ENGINEERING AND TECHNOLOGY, BELGAUM",Confirm Your Participation
4,Team Extrema,Zeeshan Shaikh,"NAGESH KARAJAGI ORCHID COLLEGE OF ENGG. & TECH., SOLAPUR",Confirm Your Participation
Emcure,SN1,1,CODEASSASINS,VISHWAS C,KGISL INSTITUTE OF TECHNOLOGY,Confirm Your Participation
2,CSE Squad,Nikhil Mandle,SIPNA COLLEGE OF ENGINEERING & TECHNOLOGY,Confirm Your Participation
3,Code Mavericks,Deven Joshi,VISHWAKARMA INSTITUTE OF INFORMATION TECHNOLOGY,Confirm Your Participation
4,PhoenixForce,Viraj Modi,SHAH AND ANCHOR KUTCHHI ENGINEERING COLLEGE,Confirm Your Participation
SN2,1,SHINKANSEN,SARTHAK KAUSHIK,PANIPAT INSTITUTE OF ENGINEERING & TECHNOLOGY,Confirm Your Participation
2,Cos-Coders,Mithilesh Raichura,GOVERNMENT ENGINEERING COLLEGE,Confirm Your Participation
3,HOPE BRIGADE,SUDARSHAN SUNDARARAJAN,SRI SAI RAM INSTITUTE OF TECHNOLOGY,Confirm Your Participation
4,Red Dragons,Prathyusha Kota,VIGNAN'S INSTITUTE OF INFORMATION TECHNOLOGY,Confirm Your Participation
SN3,1,ZAP_06,Praveen Kumar L,K RAMAKRISHNAN COLLEGE OF TECHNOLOGY,Confirm Your Participation
2,MACHINARY HOROSCOPE,HARSHA THETTE,St. Pious X Degree and P.G College for Women,Confirm Your Participation
3,TRAILBLAZERS,NITHYAPRIYAN ANNAMALAI,J.K.K.NATTRAJA COLLEGE OF PHARMACY,Confirm Your Participation
4,RUPAAM,Urmil Shah,SCTR'S PUNE INSTITUTE OF COMPUTER TECHNOLOGY,Confirm Your Participation
IndiaNeoDesign,AR2,1,Technogenius,Hrithik Auchar,MIT ACADEMY OF ENGINEERING,Confirm Your Participation
2,Kakushins,Ambar Sinha,"National Institute of Technology, Raipur",Confirm Your Participation
3,PANDAS,Sahana Srinivasan,R.V. COLLEGE OF ENGINEERING,Confirm Your Participation
4,GNDCEA-09,Harman Deep Singh,"Guru Nanak Dev University, Amritsar",Confirm Your Participation
AR4,1,Techno_Stars_06.,Rafat Parveen Ansari,PADMABHUSHAN VASANTDADA PATIL PRATISHTHAN'S COLLEGE OF ENGINEERING,Confirm Your Participation
2,Tachyons_VESIT,Karan Hemdev,VIVEKANAND EDUCATION SOCIETY'S INSTITUTE OF TECHNOLOGY,Confirm Your Participation
3,Ludo,Jayati Bhayana,YMCA University of Science & Technology,Confirm Your Participation
4,Futuristik,Syed Abdul Quadir,FUTURE INSTITUTE OF ENGINEERING AND MANAGEMENT,Confirm Your Participation
Future Generali,AK4,1,Active High,Indra Kumar V,AMRITA VISWA VIDYAPEETHAM,Confirm Your Participation
2,CoDEvils,Uddeshya Kumar,B I T SINDRI,Confirm Your Participation
3,Ctrl Alt Elitee,Rohan Bolusani,CHAITANYA BHARATHI INSTITUTE OF TECHNOLOGY,Confirm Your Participation
4,404-Found,Anurag Wani,DR. VISHWANATH KARAD MIT WORLD PEACE  UNIVERSITY,Confirm Your Participation
FIS Solutions (INDIA),AK1,1,_AlphaCoders_,Pinak Bagchi,CALCUTTA INSTITUTE OF ENGINEERING AND MANAGEMENT,Confirm Your Participation
2,Mortals,Naval Dhoot,SHRI G.S.INSTITUTE OF TECH. & SCIENCE,Confirm Your Participation
3,BYTE ME UP,Sourav Sen,Gurunanak Institute of Technology 143,Confirm Your Participation
4,Dev of Codes,Rishu Rai,"INDIAN INSTITUTE OF INFORMATION TECHNOLOGY, RANCHI",Confirm Your Participation
AK2,1,GizmoWits,Prabhu Sharan Singh,"B. M. INSTITUTE OF ENGINEERING AND TECHNOLOGY, SONEPAT",Confirm Your Participation
2,Schalofs,Pooja Kandoi,GURU GOBIND SINGH INDRAPRASTHA UNIVERSITY,Confirm Your Participation
3,HackerPeople,Madhuparna Bhowmik,"National Institute of Technology, Karnataka",Confirm Your Participation
4,Tachyonss,Sarthak Srivastava,"INDIAN INSTITUTE OF INFORMATION TECHNOLOGY, RANCHI",Confirm Your Participation
SkipperSeil,RK2,1,Codeslayer,Sachin Goyal,BHARATI VIDYAPEETH'S COLLEGE OF ENGINEERING,Confirm Your Participation
2,Team Vatsalya,Akash Srivastava,VELLORE INSTITUTE OF TECHNOLOGY CHENNAI OFF CAMPUS,Confirm Your Participation
3,GEEK GODS SBSBAR,SHUBHAM SHRIVASTAVA,"Dr. B. R. Ambedkar National Institute of Technology, Jalandhar",Confirm Your Participation
4,Incodea,Anamika Gupta,KANPUR INSTITUTE OF TECHNOLOGY,Confirm Your Participation
Amadeus Software Labs,RK1,1,</SLASH>,Utsav Shukla,THAPAR INSTITUTE OF ENGINEERING AND TECHNOLOGY,Confirm Your Participation
2,Brainstorming Cherries,Kanishka Vohra,KASTURBA POLYTECHNIC FOR WOMEN,Confirm Your Participation
3,CitadelOfRicks,Geetansh Saxena,University of Delhi,Confirm Your Participation
4,JanMitra,Puja Kumari,"Indian Institute of Technology (Indian School of Mines), Dhanbad",Confirm Your Participation
RK2,1,NIGHT HAWKS,DHEERAJ VAGAVOLU,"INDIAN INSTITUTE OF TECHNOLOGY, TIRUPATI",Confirm Your Participation
2,whack1,Bhawana Chhaglani,BHARATI VIDYAPEETH'S COLLEGE OF ENGINEERING,Confirm Your Participation
3,AR Waale,Nikit Bhandari,GURU GOBIND SINGH INDRAPRASTHA UNIVERSITY,Confirm Your Participation
4,KING IN THE COMPS,PRASHANT MISHRA,TERNA PUBLIC CHARITABLE TRUST'S  TERNA  ENGINEERING COLLEGE,Confirm Your Participation
5,TrueCoders,Mohammed Tanweer,UNIVERSAL COLLEGE OF ENGINEERING,Confirm Your Participation
Aurobindo Pharma,SK4,1,C0d3-Black,Parth Panchal,ZAGDU SINGH CHARITABLE TRUST'S THAKUR POLYTECHNIC,Confirm Your Participation
2,Mighty_Coders,Harshita Paliwal,"JAWAHARLAL INSTITUTE OF TECHNOLOGY, BORAWAN",Confirm Your Participation
3,THE TECHNO SAPIENS,NAVEEN KUMAR PUTTA,SAVEETHA INSTITUTE OF MEDICAL AND TECHNICAL SCIENCES,Confirm Your Participation
4,TECH ARMY06,Dwaraknath M S,CHENNAI INSTITUTE OF TECHNOLOGY,Confirm Your Participation
Min. of Statistics and PI,KK1,1,Tech Pirate,SelvaRamaLingam B,NADAR SARASWATHI COLLEGE OF ENGINEERING & TECHNOLOGY,Confirm Your Participation
2,Dot Slash,Malav Shah,L. D. COLLEGE OF ENGINEERING,Confirm Your Participation
3,Coding Panda,Arundhathy Pradeep,TKM COLLEGE OF ENGINEERING,Confirm Your Participation
4,Team TechSols,Prince Makwana,DEVANG PATEL INSTITUTE OF ADVANCE TECHNOLOGY AND RESEARCH,Confirm Your Participation
,KK2,1,GITCODERS,Harshit Agarwal,JAYPEE INSTITUTE OF INFORMATION TECHNOLOGY,Confirm Your Participation
2,LEAGUE OF LEGENDS,RAMACHANDRAN A,RAJAGIRI COLLEGE OF SOCIAL SCIENCES,Confirm Your Participation
3,TeamIO,Roopasri K,SRI RAMAKRISHNA ENGINEERING COLLEGE,Confirm Your Participation
4,Data Analyst,Taslim Sama,MARWADI EDUCATION FOUNDATION'S GROUP OF INSTITUTIONS,Confirm Your Participation
,KK3,1,v-coders123456,Shubh Jangam,VIDYALANKAR INSTITUTE OF TECHNOLOGY,Confirm Your Participation
2,__NARCODES__,Prateek Jain,ZAKIR HUSAIN COLLEGE OF ENGINEERING & TECHNOLOGY,Confirm Your Participation
3,TimberWolfs_A,Ashish Bhawnani,JAYPEE INSTITUTE OF INFORMATION TECHNOLOGY,Confirm Your Participation
4,Sudo Bots,Adwait Thattey,"INDIAN INSTITUTE OF INFORMATION TECHNOLOGY, CHITTOOR",Confirm Your Participation
,KK5,1,CYBORG-X,AKSHAY ANAND A,ST.PETER'S INSTITUTE OF HIGHER EDUCATION AND RESEARCH,Confirm Your Participation
2,knightcoders,Venkata SaiMeghana S,CHAITANYA BHARATHI INSTITUTE OF TECHNOLOGY,Confirm Your Participation
3,Status200_OK,Tejas Choudhari,PILLAI COLLEGE OF ENGINEERING,Confirm Your Participation
4,Error Defenders,Vishal Lawate,SKN SINHAGAD COLLEG OF   ENGINEERING KORTI  TAL PANDHARPUR  DIST-SOLAPUR,Confirm Your Participation
"ICAR, Ministry of Agriculture",SI3,1,Endgame.,Abhishek .,INSTITUTE OF ENGINEERING & MANAGEMENT,Confirm Your Participation
2,United,Guneet Singh Sethi,GURU TEGH BAHADUR INSTITUTE OF TECHNOLOGY,Confirm Your Participation
3,CODE AVENGER,Swathi P,SRI RAMAKRISHNA ENGINEERING COLLEGE,Confirm Your Participation
4,Mind Benders13,Pranjal Dave,"Birla Institute of Technology & Sciences, Pilani",Confirm Your Participation
Student Innovation,AI14,1,Codiyaap,Rajeev Sarathe,LAKSHMI NARAIN COLLEGE OF TECHNOLOGY,Confirm Your Participation
AI14,2,Scintillating Stars,Santhiya S,R.M.K. COLLEGE OF ENGINEERING AND TECHNOLOGY,Confirm Your Participation
AI14,3,Team Share,Balram Choudhary,"Indian Institute of Technology, Roorkee",Confirm Your Participation
AI14,4,CODY STARK,SHASHANK RAI,LAKSHMI NARAIN COLLEGE OF TECHNOLOGY,Confirm Your Participation
AI14,5,E&TC WARRIORS,Pooja Chavan,ARVIND GAVALI COLLEGE OF ENGINEERING,Confirm Your Participation
AI14,6,Sindhu Shrestha,Sindhu Shrestha, SONA COLLEGE OF TECHNOLOGY,Confirm Your Participation
AI7,7,Automatares,Malarvili Saravanan,KPR INSTITUTE OF ENGINEERING AND TECHNOLOGY,Confirm Your Participation
AI22,8,AVERERA,SHYAM SUNDER YADAV,MORADABAD INSTITUTE OF TECHNOLOGY,Confirm Your Participation
AI22,9,BITSTREAM,Prasad Gujar,K. J. SOMAIYA COLLEGE OF ENGINEERING,Confirm Your Participation
AI24,10,CODDICTOR,Mohan Prasad,CHANDIGARH ENGINEERING COLLEGE,Confirm Your Participation
AI22,11,Gang of Coders,Niraj Kumar,"Poornima Institute of Engineering & Technology,Jaipur",Confirm Your Participation
AI22,12,KILL A WATT,Athmaja R,SRI VENKATESWARA COLLEGE OF ENGINEERING,Confirm Your Participation
AI22,13,Spark6,Shailesh Patil,"G. H. RAISONI COLLEGE OF ENGINEERING, NAGPUR.",Confirm Your Participation
AI18,14,TERM-Inate,Kunal Khedkar,GOVERNMENT POLYTECHNIC PUNE,Confirm Your Participation
AI22,15,TESLA_TRAAM,AISHWARYAM ROMHARSHAN,C.V.RAMAN COLLEGE OF ENGINEERING,Confirm Your Participation
AI4,16,Error_coder,Balkis Begum. A,"HOLY CROSS COLLEGE(AUTONOMOUS), TIRUCHIRAPPALLI - 620 002",Confirm Your Participation
AI24,17,New Minds,Anish Kumar Sarangi,SILICON INSTITUTE OF TECHNOLOGY,Confirm Your Participation
AI25,18,PURNA DAL,Kethareswaran V,"UNIVERSITY COLLEGE OF ENGINEERING, BITCAMPUS TIRUCHIRAPPALLI",Confirm Your Participation
AI25,19,Robusto,Shubham Kumar,DRONACHARYA GROUP OF INSTITUTIONS,Confirm Your Participation
AI25,20,BlisCode,Chinmaya Naik,"G. H. RAISONI COLLEGE OF ENGINEERING, NAGPUR.",Confirm Your Participation
AI25,21,Chandragupta,Aakash Pardeshi,SNJBS LATE SAU. KANTABAI BHAVARLALJI JAIN COLLEGE OF ENGINEERING,Confirm Your Participation
AI25,22,Innovation Hunters,Aliasgar Musani,"INDIAN INSTITUTE OF TECHNOLOGY, TIRUPATI",Confirm Your Participation
AI25,23,MeZons,Dushyantha Kumar E,JSS SCIENCE AND TECHNOLOGY UNIVERSITY,Confirm Your Participation
AI2,24,Team NYN,Devassi Joseph,TKM COLLEGE OF ENGINEERING,Confirm Your Participation
AI2,25,Bulwark,PRIYA K,SRI MANAKULA VINAYAGAR ENGINEERING COLLEGE,Confirm Your Participation
AI2,26,Day Dreamers 2.0,Sai Charan N,ANURAG COLLEGE OF ENGINEERING,Confirm Your Participation
AI2,27,Acro Sphinx,Preetish Bakliwal,ACROPOLIS INSTITUTE OF TECHNOLOGY AND RESEARCH,Confirm Your Participation
AI2,28,TEAM ATOM,SHIVANI GAUTAM,BHAGWAN PARSHURAM INSTITUTE OF TECHNOLOGY,Confirm Your Participation
AI2,29,The Nameless,SOWNDARI T,SRI MANAKULA VINAYAGAR ENGINEERING COLLEGE,Confirm Your Participation
AI2,30,Mysitels,Vetrichelvan B,SRI MANAKULA VINAYAGAR ENGINEERING COLLEGE,Confirm Your Participation
AI2,31,SmartCoders,Dheemanth M D,NITTE MEENAKSHI INSTITUTE OF TECHNOLOGY,Confirm Your Participation
AI5,32,HexAR,Rishika Godgul,"MODERN EDUCATION SOCIETY'S COLLEGE OF ENGINEERING, PUNE",Confirm Your Participation
AI5,33,IRIDESCENT,Satyam Wadekar,"AMRUTVAHINI COLLEGE OF ENGINEERING, SANGAMNER",Confirm Your Participation
AI5,34,Kubs,Sayan Sinha,"Indian Institute of Technology, Kharagpur",Confirm Your Participation
AI5,35,leetcoders,Ankit Jha,SIKSHA 'O' ANUSANDHAN,Confirm Your Participation
AI5,36,PaperTree,Shubham Khulbe,SEEMANT INSTITUTE OF TECHNOLOGY (Constituent College of Uttarakhand technical University),Confirm Your Participation
AI5,37,StudieMe,Tarun Trehan,JAYPEE INSTITUTE OF INFORMATION TECHNOLOGY,Confirm Your Participation
AI5,38,The Creeping Spiders,Shubham Gupta,THAPAR INSTITUTE OF ENGINEERING AND TECHNOLOGY,Confirm Your Participation
AI5,39,The Daemons,vimanshu raj chandra,"University of Petroleum and Energy Studies, Dehradun",Confirm Your Participation
AI16,40,6 Invincibles,Banshica A singh,"G.L.A University, Mathura",Confirm Your Participation
AI2,41,Bit for Kick,Anchal Gupta,ALLENHOUSE INSTITUTE OF TECHNOLOGY,Confirm Your Participation
AI16,42,Socetians,Rudresh Mehta,SILVER OAK COLLEGE OF ENGINEERING & TECHNOLOGY,Confirm Your Participation
AI16,43,Tech Players,Kriti Kaushik,MODERN INSTITUTE OF TECHNOLOGY & RESEARCH CENTRE,Confirm Your Participation
AI7,44,Blind Navigation Crew,Rohit Chaudhary,"KARMAVEER KAKASAHEB WAGH POLYTECHNIC, NASHIK",Confirm Your Participation
AI4,45,ITIANS,VINOTHA S,E.G.S. PILLAY ENGINEERING COLLEGE,Confirm Your Participation
Harman,AB1,1,Artificially Intelligent,Apaar Gupta,NETAJI SUBHAS INSTITUTE OF TECHNOLOGY,Confirm Your Participation
2,Boltz,Arjun Vaishnav,JIET COLLEGE OF ENGINEERING,Confirm Your Participation
3,Whizz-kids,KUNAL SINHA,SCTR'S PUNE INSTITUTE OF COMPUTER TECHNOLOGY,Confirm Your Participation
4,SabMohMayaHai,Astitwa Saxena,NETAJI SUBHAS INSTITUTE OF TECHNOLOGY,Confirm Your Participation
AB2,1,Recursion,Dakshita Chaturvedi,"Indian Institute of Technology (Indian School of Mines), Dhanbad",Confirm Your Participation
2,Sahaara,Hunar Batra,Shaheed Rajguru College of Applied Sciences for Women,Confirm Your Participation
3,CRYPTIC CODERS,BHARAT NISAR,UNIVERSAL COLLEGE OF ENGINEERING,Confirm Your Participation
4,Caffeine Shots,Harini M,SRI KRISHNA COLLEGE OF TECHNOLOGY,Confirm Your Participation
Student Innovation,AI24,46,COFFEE_CODERS,Divya Merin Alex,MAR BASELIOS CHRISTIAN COLLEGE OF ENGINEERING & TECHNOLOGY,Confirm Your Participation
AI2,47,NETIZENS,ANUKRITI MISHRA,RUNGTA COLLEGE OF ENGINEERING & TECHNOLOGY,Confirm Your Participation
AI24,48,Web_devs,Raj Shah,UNIVERSAL COLLEGE OF ENGINEERING,Confirm Your Participation
AI12,49,Alpha Centari,Samit Shirsat,SHREE RAYESHWAR INSTITUTE OF ENGINEERING AND INFORMATION TECHNOLOY,Confirm Your Participation
AI5,50,CODELAGOM,Rudra Madhav Biswal,COLLEGE OF ENGINEERING AND TECHNOLOGY,Confirm Your Participation
AI12,51,Divyang,Md Bilal Zafri,ACCURATE INSTITUTE OF MANAGEMENT & TECHNOLOGY,Confirm Your Participation
AI12,52,Team Neuron,Nikhil Saini,APEX INSTITUTE OF ENGINEERING & TECHNOLOGY,Confirm Your Participation
AI12,53,Team6,venniammal A,SRI MANAKULA VINAYAGAR ENGINEERING COLLEGE,Confirm Your Participation
AI12,54,TeamX,pooja maheshwari,JAIPUR ENGINEERING COLLEGE AND RESEARCH CENTRE,Confirm Your Participation
AI12,55,Tech Paranoid,Akshaj Nair,COLLEGE OF ENGINEERING ROORKEE,Confirm Your Participation
AI12,56,TRISHNA,Vishal Singh,"University of Petroleum and Energy Studies, Dehradun",Confirm Your Participation
AI7,57,pict@hack,Devdatta Pande,SCTR'S PUNE INSTITUTE OF COMPUTER TECHNOLOGY,Confirm Your Participation
AI7,58,CAREFOR,LOKESH RAMESH,ST. JOSEPH'S COLLEGE OF ENGINEERING,Confirm Your Participation
AI7,59,Companion,Rohit Raj,SARANATHAN COLLEGE OF ENGINEERING,Confirm Your Participation
AI24,60,The Elite Coders,VISHAL AHER,JAYAWANT SHIKSHAN PRASARAK MANDAL'S IMPERIAL COLLEGE OF ENGINEERING AND RESEARCH,Confirm Your Participation
AI18,61,Bit_Byte,Arjeet Singh Banchhor,SHRI SHANKARACHARYA GROUP OF INSTITUTIONS,Confirm Your Participation
AI18,62,GAIKO TEKI,Prethika R.B,KNOWLEDGE INSTITUTE OF TECHNOLOGY,Confirm Your Participation
AI18,63,Incredibles_6,Venkatesh Raju Pattigadapa,"National Institute of Technology, Calicut",Confirm Your Participation
AI18,64,JumpStart-UP,Drashti Patel,"Nirma University, Ahmedabad",Confirm Your Participation
AI18,65,SAP.RAP,Sunamya Gupta,GOVT. MAHILA ENGINEERING COLLEGE AJMER,Confirm Your Participation
AI18,66,Solutions Seekers,Jayant Sethi,HMR INSTITUTE OF TECHNOLOGY AND MANAGEMENT,Confirm Your Participation
AI18,67,TeamNet,Vedik Dave,SARVAJANIK COLLEGE OF ENGINEERING & TECHNOLOGY,Confirm Your Participation
AI26,68,code.inc,Devi VS,MAR BASELIOS COLLEGE OF ENGINEERING AND TECHNOLOGY,Confirm Your Participation
AI26,69,Code_RECCERS,Niranjan Patra,"GANDHI INSTITUTE FOR TECHNOLOGY(GIFT), BHUBANESWAR",Confirm Your Participation
AI26,70,Dynamic DevOps,Chetan Parihar,JIET COLLEGE OF ENGINEERING,Confirm Your Participation
AI26,71,HIRE MECHANIC,ARIF AKRAM SK MOHAMMAD,R.V.R.& J.C.COLLEGE OF ENGINEERING,Confirm Your Participation
AI26,72,JANVITHA,JANVITHA K,MALLA REDDY ENGINEERING COLLEGE FOR WOMEN,Confirm Your Participation
AI26,73,safe_Hack,ATUL SHRIVAS,GYAN GANGA INSTITUTE OF TECHNOLOGY & SCIENCES,Confirm Your Participation
AI26,74,TECHNO VISION A2R3S,Aditya Ranjan,G.L. BAJAJ INSTITUTE OF TECHNOLOGY AND MANAGEMENT,Confirm Your Participation
AI26,75,V-Sharp,Baljeet Singh,GYAN GANGA INSTITUTE OF TECHNOLOGY & SCIENCES,Confirm Your Participation
AI26,76,ANYONE,Versha Biswas,INSTITUTE OF ENGINEERING AND TECHNOLOGY,Confirm Your Participation
AI26,77,DELBUZZ INNOVATION,Rohit Kumar,RAJASTHAN INSTITUTE OF ENGINEERING & TECHNOLOGY,Confirm Your Participation
SKF India Ltd,RU3,1,Rainbow1,Dipayan Ray,DR. SUDHIR CHANDRA SUR DEGREE ENGINEERING COLLEGE,Confirm Your Participation
,2,i6,Kiruthika R,"UNIVERSITY COLLEGE OF ENGINEERING, BITCAMPUS TIRUCHIRAPPALLI",Confirm Your Participation
,3,Wincoder,Soumya Shrivastava,SAGAR INSTITUTE OF RESEARCH & TECHNOLOGY- EXCELLENCE,Confirm Your Participation
,4,CYBER TECHZ,HARISH SANMUGAM J,SRI KRISHNA COLLEGE OF ENGINEERING AND TECHNOLOGY,Confirm Your Participation
ISRO,GG1,1,CodeRedd,Ajay Vallala,"Indian Institute of Technology, Kharagpur",Confirm Your Participation
2,P@r@digm,Deepak Prasad,HERITAGE INSTITUTE OF TECHNOLOGY,Confirm Your Participation
3,AsphaltX,Rut Vora,"Birla Institute of Technology & Sciences, Pilani",Confirm Your Participation
4,Appthletes,Gargi Balasubramaniam,"Birla Institute of Technology & Sciences, Pilani",Confirm Your Participation
GG2,1,Code Alchemists,Atharva Khare,SMT. KASHIBAI NAVALE COLLEGE OF ENGINEERING,Confirm Your Participation
2,comrade16,Naman Agarwal,THE LNM INSTITUTE OF INFORMATION TECHNOLOGY,Confirm Your Participation
3,KRASPR,LA SELENE DOMMU,ADITYA COLLEGE OF ENGINEERING & TECHNOLOGY,Confirm Your Participation
4,AllStar,Chelsea Lodha,"Techno India NJR Institute of Technology,Udaipur",Confirm Your Participation
GG3,1,GradientAscent,Piyush Hajare,SCTR'S PUNE INSTITUTE OF COMPUTER TECHNOLOGY,Confirm Your Participation
2,Atulya_6,Vindeep Chaudhari,SCTR'S PUNE INSTITUTE OF COMPUTER TECHNOLOGY,Confirm Your Participation
3,Tech@rmy,Shivansh Soni,GYAN GANGA INSTITUTE OF TECHNOLOGY & SCIENCES,Confirm Your Participation
4,THE FORGERS,Srisai Venkata Kamal Mohan Addepalli,AMRITA SCHOOL OF ENGINEERING,Confirm Your Participation
GG4,1,GAGANYAAN,SELVAM GANESAN,MANAKULA VINAYAGAR INSTITUTE OF TECHNOLOGY,Confirm Your Participation
2,ALPHA-QUEUE,AMBIKA SIVAKUMAR,ANNA UNIVERSITY,Confirm Your Participation
3,Prerana,Pravesh P,AMRITA VISWA VIDYAPEETHAM,Confirm Your Participation
4,The_Back_Codes,Salil Prakash Ekka,INDIRA GANDHI INSTITUTE OF TECHNOLOGY SARANG,Confirm Your Participation
GG5,1,Dynamic Dudes@,Pratiksha Goyal,MODERN INSTITUTE OF TECHNOLOGY & RESEARCH CENTRE,Confirm Your Participation
2,Classical Coders,Alen Daniel P,K RAMAKRISHNAN COLLEGE OF TECHNOLOGY,Confirm Your Participation
3,Erudites,Lokesh P,MANAKULA VINAYAGAR INSTITUTE OF TECHNOLOGY,Confirm Your Participation
4,Tadashi,Anupam Karn,"National Institute of Technology, Raipur",Confirm Your Participation
GG6,1,HEXSPEAKS,GAYATHRI R,SRI MANAKULA VINAYAGAR ENGINEERING COLLEGE,Confirm Your Participation
2,SATSTARS,USHAA S,THIAGARAJAR COLLEGE OF ENGINEERING,Confirm Your Participation
3,Apisteftos,RAJESH K,ADHI COLLEGE OF ENGINEERING AND TECNOLOGY,Confirm Your Participation
4,Mission VSAT,Venkata Sairam Uppuluri,CVR COLLEGE OF ENGINEERING,Confirm Your Participation
GG7,1,Marvel_Us,Priyanka R,SRI KRISHNA COLLEGE OF ENGINEERING AND TECHNOLOGY,Confirm Your Participation
2,_Error404_,Deva Kumar Kilim,"Pragati Engineering College, 1-378, ADB Road, Surampalem, Near Peddapuram,PIN- 533437  (CC-A3)",Confirm Your Participation
3,Baby Got Hack,Shivam Kaushik,MAHARAJA AGRASEN INSTITUTE OF TECHNOLOGY,Confirm Your Participation
4,Expecto Patronum,Dhyakesh S,SRI KRISHNA COLLEGE OF ENGINEERING AND TECHNOLOGY,Confirm Your Participation
SKF India Ltd,RU01,1,Hacoders,Rosalind Sugumar,ST.JOSEPH'S INSTITUTE OF TECHNOLOGY,Confirm Your Participation
2,Hitechno,Laveena Sri B,HINDUSTHAN INSTITUTE OF TECHNOLOGY,Confirm Your Participation
3,Ypaxx,Yogesh Patel,MGM'S COLLEGE OF ENGINEERING AND TECHNOLOGY,Confirm Your Participation
4,FUSION1,Jai Krishna Kumar,"PES INSTITUTE OF TECHNOLOGY, BANGALORE SOUTH CAMPUS",Confirm Your Participation
RU02,1,6Sense,Ajay Gupta,PADMABHUSHAN VASANTDADA PATIL PRATISHTHAN'S COLLEGE OF ENGINEERING,Confirm Your Participation
2,SPixians,Jnanesh Bhat,BHARATIYA VIDYA BHAVANS SARDAR PATEL INSTITUTE OF TECHNOLOGY,Confirm Your Participation
3,Zero2one,Dheeraj Komandur,DR. VISHWANATH KARAD MIT WORLD PEACE  UNIVERSITY,Confirm Your Participation
4,Enigma3301,Sukriti Chaudhary,NETAJI SUBHAS INSTITUTE OF TECHNOLOGY,Confirm Your Participation
Goa Shipyard Ltd,VA5,1,Codaholic Daemons,Sumit Kumathalli,INDIRA COLLEGE OF ENGINEERING & MANAGEMENT,Confirm Your Participation
2,SourceDeCode,Naman Mehra,INSTITUTE OF ENGINEERING & TECHNOLOGY,Confirm Your Participation
3,Ctrl+Alt+Defeat 2.0,Chandana M,VIDYAVARDHAKA COLLEGE OF ENGINEERING,Confirm Your Participation
4,TwistedTechies,Bhavna Soni,"National Institute of Technology, Raipur",Confirm Your Participation
VA6,1,Parameterized Constructors,Rupa SaiSree,CHENNAI INSTITUTE OF TECHNOLOGY,Confirm Your Participation
2,Scirists,Brayan Christian,GANDHINAGAR INSTITUTE OF TECHNOLOGY,Confirm Your Participation
3,The Bro Code,Dharmit Shah,UNIVERSAL COLLEGE OF ENGINEERING,Confirm Your Participation
4,Priori_Incantatem,Ananya Gulati,BIRLA INSTITUTE OF TECHNOLOGY,Confirm Your Participation
VA7,1,Diac,Ashish Aryan,"National Institute of Technology, Jamshedpur",Confirm Your Participation
2,Tell_Us_SOmething_Which_We_Dont_Know!!,Gunjan Singh,WALCHAND COLLEGE OF ENGINEERING,Confirm Your Participation
3,MYSTIC DAEMONS,BHARATH RAJ T,JAYA ENGINEERING COLLEGE,Confirm Your Participation
4,DMIETR_ENIGMA,Hrushikesh Zade,DATTA MEGHE INSTITUTE OF ENGINEERING TECHNOLOGY AND RESEARCH,Confirm Your Participation
VA8,1,Gully bois,Ashay Changwani,THADOMAL SHAHANI ENGINEERING COLLEGE,Confirm Your Participation
2,Coding Champs,Akash Bhimani,UNIVERSAL COLLEGE OF ENGINEERING,Confirm Your Participation
3,3 Bananas,Dhiraj Das,"Indian Institute of Technology, Kharagpur",Confirm Your Participation
4,Drifterss,Vrushali Deshpande,DR. D. Y. PATIL INSTITUTE OF ENGINEERING MANAGEMENT  RESEARCH,Confirm Your Participation
VMware Software Services,SV1,1,Linguistic Coders,Ajay _,Hans Raj College,Confirm Your Participation
2,Bits 'N' Bytes,Rohan N,KONGUNADU COLLEGE OF ENGINEERING AND TECHNOLOGY,Confirm Your Participation
3,IETIAN,HARSH JAIN,INSTITUTE OF ENGINEERING AND TECHNOLOGY,Confirm Your Participation
4,CodeProof Monks,Srushti Pathak,SHRI VILE PARLE KELAVANI MANDAL'S DWARKADAS J. SANGHVI COLLEGE OF ENGINEERING,Confirm Your Participation
Mahindra&Mahindra(FarmEq),MJ3,1,BitByBit,Ankit Kishore,S.R. M INSTITUTE OF SCIENCE AND TECHNOLOGY,Confirm Your Participation
2,Still_Variable,Vaishnavi Saxena,AMBEDKAR INSTITUTE OF TECHNOLOGY,Confirm Your Participation
3,iVision6,Samveg Thaker,"National Institute of Technology, Raipur",Confirm Your Participation
4,ZOROS,HARIHARAN S,SRI KRISHNA COLLEGE OF ENGINEERING AND TECHNOLOGY,Confirm Your Participation
Sun Pharmaceuticals,DD1,1,HEXADA,Arpit kumar Mishra,ARMY INSTITUTE OF TECHNOLOGY,Confirm Your Participation
